number,value,datetime_start,datetime_complete,duration,params_ccp_alpha,params_criterion,params_max_depth,params_max_features,params_min_impurity_decrease,params_min_samples_leaf,params_min_samples_split,state
0,0.2679704914998237,2026-06-13 23:11:52.448576,2026-06-13 23:11:53.232595,0 days 00:00:00.784019,0.0032748322944379776,entropy,3,0.5073516086942953,0.007872367661437235,8,2,COMPLETE
1,0.25670926531598093,2026-06-13 23:11:53.233383,2026-06-13 23:11:54.101397,0 days 00:00:00.868014,0.0049492731205216705,gini,15,0.7633714966431897,0.004537456990382522,11,14,COMPLETE
2,0.2679704914998237,2026-06-13 23:11:54.102163,2026-06-13 23:11:55.232569,0 days 00:00:01.130406,0.00480231824599238,entropy,10,0.9927159453649829,0.00955425917684365,16,6,COMPLETE
3,0.21273152785583038,2026-06-13 23:11:55.233442,2026-06-13 23:11:55.932221,0 days 00:00:00.698779,0.0009835569550522521,gini,8,0.687474640071221,0.006740653258677544,2,20,COMPLETE
4,0.21273152785583038,2026-06-13 23:11:55.932803,2026-06-13 23:11:56.597762,0 days 00:00:00.664959,0.0027719206383478136,entropy,10,0.47562785392500473,0.008654324218304053,20,18,COMPLETE
5,0.31876459753013536,2026-06-13 23:11:56.598374,2026-06-13 23:11:57.745666,0 days 00:00:01.147292,4.008041350799019e-05,entropy,5,0.646042891869165,0.0019355957765553344,11,20,COMPLETE
6,0.25670926531598093,2026-06-13 23:11:57.746497,2026-06-13 23:11:58.543450,0 days 00:00:00.796953,0.0037690591332327572,gini,10,0.5758632292620568,0.006019177322558378,18,9,COMPLETE
7,0.25670926531598093,2026-06-13 23:11:58.544156,2026-06-13 23:11:59.457139,0 days 00:00:00.912983,0.0022454700069808402,gini,9,0.9769756604699507,0.004695518493154517,11,12,COMPLETE
8,0.310199190896614,2026-06-13 23:11:59.457552,2026-06-13 23:12:01.232949,0 days 00:00:01.775397,0.0021486381020664204,entropy,12,0.9901360883238128,0.0006272698682859523,7,6,COMPLETE
9,0.2971734667595475,2026-06-13 23:12:01.233514,2026-06-13 23:12:02.420546,0 days 00:00:01.187032,0.004696019134618591,entropy,4,0.9355855227494781,0.0039971008503064676,8,9,COMPLETE
10,0.3644354173974941,2026-06-13 23:12:02.420986,2026-06-13 23:12:03.499975,0 days 00:00:01.078989,5.4898146115695696e-05,entropy,6,0.40100254347990627,0.0001015562107276706,1,15,COMPLETE
11,0.36862934245675427,2026-06-13 23:12:03.500823,2026-06-13 23:12:04.842307,0 days 00:00:01.341484,4.375860407954964e-05,entropy,6,0.6495021460962473,0.0002879961145242447,3,16,COMPLETE
12,0.36188115838976026,2026-06-13 23:12:04.842841,2026-06-13 23:12:05.918926,0 days 00:00:01.076085,0.00015810555928714868,entropy,6,0.40867657754888637,7.47973408128334e-05,1,15,COMPLETE
13,0.31754640094508446,2026-06-13 23:12:05.919503,2026-06-13 23:12:07.196553,0 days 00:00:01.277050,0.001008692479307602,entropy,7,0.8341764604290217,0.0020396002768588908,4,16,COMPLETE
14,0.318658414944302,2026-06-13 23:12:07.197245,2026-06-13 23:12:08.073627,0 days 00:00:00.876382,0.000811080916166558,entropy,6,0.40579122873906737,0.0017448968367991498,4,12,COMPLETE
15,0.29359139933439915,2026-06-13 23:12:08.075506,2026-06-13 23:12:09.091513,0 days 00:00:01.016007,0.0015598060171153868,entropy,4,0.584402121789357,0.003191367248790694,4,17,COMPLETE
16,0.3512033070379613,2026-06-13 23:12:09.092044,2026-06-13 23:12:10.493958,0 days 00:00:01.401914,0.0004866893195669571,entropy,7,0.8171298789368218,0.0008736179509299427,1,12,COMPLETE
17,0.30468773378669106,2026-06-13 23:12:10.494438,2026-06-13 23:12:11.557924,0 days 00:00:01.063486,0.0014698085416002793,entropy,12,0.6946097799790919,0.0028620286825303516,6,14,COMPLETE
18,0.30225711265221966,2026-06-13 23:12:11.558354,2026-06-13 23:12:12.323471,0 days 00:00:00.765117,1.7568738030115352e-05,gini,3,0.5354173272448438,2.8219004182068654e-06,3,18,COMPLETE
19,0.34022045100496323,2026-06-13 23:12:12.323920,2026-06-13 23:12:13.435412,0 days 00:00:01.111492,0.0006077285031776674,entropy,5,0.6240957294514499,0.0012028344731555706,6,10,COMPLETE
20,0.30220352009284046,2026-06-13 23:12:13.436371,2026-06-13 23:12:14.628062,0 days 00:00:01.191691,0.0013470051784368869,entropy,8,0.890352701341887,0.0027896852706802426,14,14,COMPLETE
21,0.36015612514868983,2026-06-13 23:12:14.629399,2026-06-13 23:12:15.701280,0 days 00:00:01.071881,0.00019696797153741092,entropy,6,0.4077455819320682,0.0001343332117322877,1,16,COMPLETE
22,0.3275878786621194,2026-06-13 23:12:15.702462,2026-06-13 23:12:16.697303,0 days 00:00:00.994841,0.0003785074672462323,entropy,6,0.4563433492205496,0.0012165556962937239,3,15,COMPLETE
23,0.33877685478317265,2026-06-13 23:12:16.697963,2026-06-13 23:12:17.717373,0 days 00:00:01.019410,0.0005931462118337729,entropy,5,0.46705057718842513,4.623944066865101e-06,1,18,COMPLETE
24,0.3219170078455174,2026-06-13 23:12:17.717922,2026-06-13 23:12:18.725847,0 days 00:00:01.007925,2.835666722137819e-05,entropy,7,0.527630317868817,0.0011850843455087038,3,13,COMPLETE
25,0.31169574084549556,2026-06-13 23:12:18.726374,2026-06-13 23:12:19.612125,0 days 00:00:00.885751,0.0011413766702808841,entropy,8,0.4009219248191998,0.0022639292960346885,5,16,COMPLETE
26,0.28549071675480653,2026-06-13 23:12:19.612803,2026-06-13 23:12:20.393202,0 days 00:00:00.780399,0.001851459393448969,gini,4,0.460302324036029,0.0007161762219878658,1,11,COMPLETE
27,0.3372076287339976,2026-06-13 23:12:20.393856,2026-06-13 23:12:21.634706,0 days 00:00:01.240850,0.0007044941113565112,entropy,6,0.7505118118215018,0.0017335886316784722,2,19,COMPLETE
28,0.3504079555310681,2026-06-13 23:12:21.635538,2026-06-13 23:12:22.915089,0 days 00:00:01.279551,0.0003706669658120722,entropy,9,0.5714752772268611,0.0005900841223132938,5,15,COMPLETE
29,0.3019114380174243,2026-06-13 23:12:22.915627,2026-06-13 23:12:23.713346,0 days 00:00:00.797719,0.0002998181706288768,entropy,3,0.5061868773308003,0.0014227600494930656,8,17,COMPLETE
30,0.3078937644006468,2026-06-13 23:12:23.713917,2026-06-13 23:12:24.576196,0 days 00:00:00.862279,0.0008336553466285427,entropy,5,0.44286386274748646,0.0032313749697506396,2,2,COMPLETE
31,0.36364991015563075,2026-06-13 23:12:24.576914,2026-06-13 23:12:25.706673,0 days 00:00:01.129759,0.00018096455623730495,entropy,6,0.41522052350659056,1.7786916136287352e-06,1,16,COMPLETE
32,0.3478462094980755,2026-06-13 23:12:25.709085,2026-06-13 23:12:26.799587,0 days 00:00:01.090502,0.0003464303075955591,entropy,7,0.5026518987532604,0.0005804534471209593,3,15,COMPLETE
33,0.36641971611186586,2026-06-13 23:12:26.800278,2026-06-13 23:12:27.956598,0 days 00:00:01.156320,2.8058090605431616e-05,entropy,6,0.4358080771632265,4.1074301962366454e-06,1,14,COMPLETE
34,0.27562989026291423,2026-06-13 23:12:27.957156,2026-06-13 23:12:28.661775,0 days 00:00:00.704619,0.001231577059435887,gini,15,0.5366191421777509,0.002373638058613088,2,13,COMPLETE
35,0.32775515684127277,2026-06-13 23:12:28.662268,2026-06-13 23:12:29.586868,0 days 00:00:00.924600,0.0006347041927593804,entropy,4,0.43691904582265895,0.0005809784764230941,5,17,COMPLETE
36,0.3156267431678591,2026-06-13 23:12:29.587441,2026-06-13 23:12:30.626235,0 days 00:00:01.038794,0.000895275571358375,entropy,9,0.49853173537260914,0.0012810231696329995,2,19,COMPLETE
37,0.36361381775399065,2026-06-13 23:12:30.626739,2026-06-13 23:12:31.957550,0 days 00:00:01.330811,5.857684950843746e-06,entropy,8,0.6696818585957646,0.0003506991939420269,4,13,COMPLETE
38,0.25670926531598093,2026-06-13 23:12:31.958100,2026-06-13 23:12:32.741114,0 days 00:00:00.783014,0.0004329822606757441,gini,5,0.6155554258021524,0.006819376947702112,3,14,COMPLETE
39,0.24455540115238888,2026-06-13 23:12:32.743881,2026-06-13 23:12:33.537301,0 days 00:00:00.793420,0.004196819619840163,entropy,7,0.7074460096188974,0.00978961498170898,10,19,COMPLETE
40,0.2539447819495364,2026-06-13 23:12:33.537910,2026-06-13 23:12:34.357250,0 days 00:00:00.819340,0.0028368904071603253,gini,6,0.4353825028331551,0.0009756277511397089,6,7,COMPLETE
41,0.35990451717936156,2026-06-13 23:12:34.357803,2026-06-13 23:12:35.651199,0 days 00:00:01.293396,1.1866113673416692e-05,entropy,8,0.6694288699273648,0.00044781020274963586,4,13,COMPLETE
42,0.3412830077363655,2026-06-13 23:12:35.651771,2026-06-13 23:12:36.922299,0 days 00:00:01.270528,0.0002663817369591967,entropy,10,0.755556727214655,0.0015698414205941212,2,11,COMPLETE
43,0.3698886345370994,2026-06-13 23:12:36.922768,2026-06-13 23:12:38.363803,0 days 00:00:01.441035,5.7732516081125055e-06,entropy,7,0.8001633831644767,0.0003729669934929341,1,16,COMPLETE
44,0.22446348679781897,2026-06-13 23:12:38.364281,2026-06-13 23:12:39.308731,0 days 00:00:00.944450,0.001012395808170302,entropy,7,0.8374370506359545,0.009021943474067914,1,16,COMPLETE
45,0.35226203316631866,2026-06-13 23:12:39.309446,2026-06-13 23:12:40.642901,0 days 00:00:01.333455,0.0005442060253498656,entropy,5,0.7828501334303863,0.0008840178400493484,1,17,COMPLETE
46,0.37549064743582933,2026-06-13 23:12:40.643931,2026-06-13 23:12:42.359020,0 days 00:00:01.715089,0.00023595244307171904,entropy,6,0.9005116283930402,7.635962673333178e-05,2,15,COMPLETE
47,0.3277443384307587,2026-06-13 23:12:42.359573,2026-06-13 23:12:43.718235,0 days 00:00:01.358662,0.0007703557865146734,entropy,7,0.895436474923653,0.0019045431904266608,15,15,COMPLETE
48,0.3626835323676734,2026-06-13 23:12:43.719068,2026-06-13 23:12:45.281932,0 days 00:00:01.562864,0.000237245679460043,entropy,5,0.9428307197259189,0.0004787838885389591,3,14,COMPLETE
49,0.273052727542511,2026-06-13 23:12:45.282622,2026-06-13 23:12:46.363922,0 days 00:00:01.081300,0.0005324040677575695,entropy,4,0.9019010783779732,0.005098416781123223,2,20,COMPLETE
50,0.34715550046964,2026-06-13 23:12:46.364357,2026-06-13 23:12:47.864198,0 days 00:00:01.499841,0.0009884451822745148,entropy,12,0.8697107234151158,0.0009396911823108131,5,18,COMPLETE
51,0.3778822074728644,2026-06-13 23:12:47.864589,2026-06-13 23:12:49.664673,0 days 00:00:01.800084,0.00018610306837461705,entropy,6,0.9482836228998085,1.2231372779801248e-05,2,16,COMPLETE
52,0.373229797019229,2026-06-13 23:12:49.665178,2026-06-13 23:12:51.409779,0 days 00:00:01.744601,0.0001715387722011702,entropy,6,0.9663946260215086,0.00033021166508515965,2,15,COMPLETE
53,0.37229304873901264,2026-06-13 23:12:51.410385,2026-06-13 23:12:53.138677,0 days 00:00:01.728292,0.00021191786349628126,entropy,14,0.9544018228285257,0.00036282941271954664,19,17,COMPLETE
54,0.3350137951325148,2026-06-13 23:12:53.139508,2026-06-13 23:12:54.608519,0 days 00:00:01.469011,0.000434408369796203,entropy,14,0.9633708814396399,0.0015183746000618475,20,17,COMPLETE
55,0.37064926313702096,2026-06-13 23:12:54.609511,2026-06-13 23:12:56.345177,0 days 00:00:01.735666,0.0002136620669217283,entropy,14,0.9291589249380915,0.0003864377319320538,17,16,COMPLETE
56,0.3541333867309926,2026-06-13 23:12:56.348013,2026-06-13 23:12:57.901460,0 days 00:00:01.553447,0.0006988374012846703,entropy,14,0.9970045879480535,0.0009231218666244541,19,18,COMPLETE
57,0.35654039222743594,2026-06-13 23:12:57.901843,2026-06-13 23:12:59.219978,0 days 00:00:01.318135,0.00022592678105769619,gini,13,0.9218214198692584,0.00035285711762650883,17,15,COMPLETE
58,0.3183702565850791,2026-06-13 23:12:59.220705,2026-06-13 23:13:00.503095,0 days 00:00:01.282390,0.00048107785886639565,entropy,11,0.9638740759459314,0.0024442326848076457,13,17,COMPLETE
59,0.34294294324282104,2026-06-13 23:13:00.503470,2026-06-13 23:13:01.965811,0 days 00:00:01.462341,0.00028640372126242133,entropy,14,0.8668010767872927,0.0011212407864870366,18,16,COMPLETE
60,0.3207460112764836,2026-06-13 23:13:01.966396,2026-06-13 23:13:03.304384,0 days 00:00:01.337988,0.001196980368382998,entropy,13,0.9290698423760408,0.0019975636769545514,17,19,COMPLETE
61,0.3733166711051027,2026-06-13 23:13:03.304825,2026-06-13 23:13:05.113466,0 days 00:00:01.808641,0.00014394280848307317,entropy,14,0.9599275799176903,0.0003219893492287003,13,16,COMPLETE
62,0.3738006122368161,2026-06-13 23:13:05.114156,2026-06-13 23:13:06.936667,0 days 00:00:01.822511,0.00017137068231547355,entropy,15,0.9733357595904167,0.00031023032537857704,19,15,COMPLETE
63,0.3603005923886536,2026-06-13 23:13:06.937133,2026-06-13 23:13:08.615280,0 days 00:00:01.678147,0.00019160961621298816,entropy,15,0.9796229204379565,0.0007251665071238345,19,15,COMPLETE
64,0.3568074039447676,2026-06-13 23:13:08.616014,2026-06-13 23:13:10.411428,0 days 00:00:01.795414,0.0007426755869669138,entropy,13,0.9494749023804125,0.0003062042069397146,19,16,COMPLETE
65,0.3366658113530486,2026-06-13 23:13:10.412089,2026-06-13 23:13:11.856247,0 days 00:00:01.444158,0.0005476571792989438,entropy,14,0.9158826166414418,0.001338677913014614,16,17,COMPLETE
66,0.3601771325819748,2026-06-13 23:13:11.856916,2026-06-13 23:13:13.661614,0 days 00:00:01.804698,0.00015627631245310493,entropy,15,0.9617186043649516,0.0006788127695818182,12,15,COMPLETE
67,0.34836760653079535,2026-06-13 23:13:13.662066,2026-06-13 23:13:15.470249,0 days 00:00:01.808183,0.000884408999674987,entropy,14,0.8759377021585616,0.00020916967106191374,9,18,COMPLETE
68,0.33484588675031934,2026-06-13 23:13:15.470685,2026-06-13 23:13:16.950461,0 days 00:00:01.479776,0.0003988944213287553,entropy,13,0.9794021275278725,0.0016647121565593987,18,14,COMPLETE
69,0.31255135594983013,2026-06-13 23:13:16.951486,2026-06-13 23:13:18.074279,0 days 00:00:01.122793,0.00013810340526672154,gini,15,0.9399255793025819,0.0010850928965061286,15,3,COMPLETE
70,0.3575667922380352,2026-06-13 23:13:18.074759,2026-06-13 23:13:19.609758,0 days 00:00:01.534999,0.0003419213109174602,entropy,12,0.9083478661752689,0.0007623170907854802,20,12,COMPLETE
71,0.3607684545070017,2026-06-13 23:13:19.610813,2026-06-13 23:13:21.492203,0 days 00:00:01.881390,0.0006482782434433221,entropy,14,0.9938410191566525,0.00023402447085481737,18,16,COMPLETE
72,0.36344737050736364,2026-06-13 23:13:21.492919,2026-06-13 23:13:23.052695,0 days 00:00:01.559776,0.0001365024748493233,entropy,15,0.8388475126260605,0.0004498353535740356,17,15,COMPLETE
73,0.3680974752193028,2026-06-13 23:13:23.055596,2026-06-13 23:13:25.175230,0 days 00:00:02.119634,0.00042372967382956693,entropy,11,0.952834714347875,6.735689066346976e-05,20,16,COMPLETE
74,0.3565538500209765,2026-06-13 23:13:25.175925,2026-06-13 23:13:26.546380,0 days 00:00:01.370455,0.00011607030912066215,entropy,13,0.8071716591633509,0.0006683372091512824,19,14,COMPLETE
75,0.3330232203204881,2026-06-13 23:13:26.547249,2026-06-13 23:13:27.977207,0 days 00:00:01.429958,0.00029998827344179606,entropy,11,0.8846736017100985,0.0012967969750847287,12,17,COMPLETE
76,0.37123475311607546,2026-06-13 23:13:27.977998,2026-06-13 23:13:29.715599,0 days 00:00:01.737601,6.3296155184541444e-06,entropy,15,0.9264482069580039,0.000377608917848963,15,16,COMPLETE
77,0.36114941038576087,2026-06-13 23:13:29.716271,2026-06-13 23:13:32.504614,0 days 00:00:02.788343,0.0005818055767636647,entropy,14,0.9292455463389971,1.050019001546461e-05,16,13,COMPLETE
78,0.2679704914998237,2026-06-13 23:13:32.505107,2026-06-13 23:13:33.615613,0 days 00:00:01.110506,0.0003240016756960674,entropy,15,0.9666016002469242,0.007578173344161485,14,15,COMPLETE
79,0.3001433938516126,2026-06-13 23:13:33.616344,2026-06-13 23:13:35.081412,0 days 00:00:01.465068,0.0031901072079991155,entropy,15,0.8537820447240883,0.0009130282038990814,17,18,COMPLETE
80,0.2906609762923823,2026-06-13 23:13:35.083210,2026-06-13 23:13:36.770726,0 days 00:00:01.687516,0.004930652933409676,entropy,14,0.9118365861598796,0.0005326520398123333,15,14,COMPLETE
81,0.37363978538917253,2026-06-13 23:13:36.771180,2026-06-13 23:13:38.595825,0 days 00:00:01.824645,4.371142342125779e-05,entropy,15,0.9804538837672911,0.00030803978693736957,16,16,COMPLETE
82,0.3769547025567692,2026-06-13 23:13:38.596312,2026-06-13 23:13:40.504928,0 days 00:00:01.908616,0.00015122238375802892,entropy,15,0.9809206115494219,0.00023511090468979708,16,17,COMPLETE
83,0.376365088593279,2026-06-13 23:13:40.505359,2026-06-13 23:13:42.357762,0 days 00:00:01.852403,8.03072171902873e-05,entropy,15,0.9771912417102715,0.00027031716290836833,16,17,COMPLETE
84,0.35861807779816535,2026-06-13 23:13:42.358333,2026-06-13 23:13:43.958552,0 days 00:00:01.600219,0.00045324439315174797,entropy,15,0.9846268785020746,0.0007678195150274212,14,17,COMPLETE
85,0.3801075147788001,2026-06-13 23:13:43.959251,2026-06-13 23:13:45.882278,0 days 00:00:01.923027,0.00014649903219758278,entropy,15,0.9973667098962989,0.0002003299760392086,16,17,COMPLETE
86,0.37211168772516734,2026-06-13 23:13:45.883000,2026-06-13 23:13:47.384147,0 days 00:00:01.501147,0.00015065559277282608,gini,15,0.9756531721534336,0.00016035475985202476,16,18,COMPLETE
87,0.34324768089419505,2026-06-13 23:13:47.386076,2026-06-13 23:13:48.903162,0 days 00:00:01.517086,9.3253594489327e-05,entropy,15,0.999212171482405,0.001077364779775866,13,19,COMPLETE
88,0.3600847861861299,2026-06-13 23:13:48.903640,2026-06-13 23:13:51.568185,0 days 00:00:02.664545,0.0006187185209230592,entropy,15,0.9445233243552644,2.2587410304995287e-05,16,18,COMPLETE
89,0.3350137951325148,2026-06-13 23:13:51.568704,2026-06-13 23:13:53.029274,0 days 00:00:01.460570,0.0003419642455735189,entropy,15,0.9745726735022249,0.0014310704392442193,13,20,COMPLETE
90,0.3583211361774721,2026-06-13 23:13:53.030022,2026-06-13 23:13:54.724604,0 days 00:00:01.694582,0.0008012341429438168,entropy,6,0.9999051055349261,0.0005878089474889858,10,16,COMPLETE
91,0.37635140942398204,2026-06-13 23:13:54.726276,2026-06-13 23:13:56.613252,0 days 00:00:01.886976,0.000255494458725338,entropy,14,0.954758494433935,0.00023106585498306587,18,17,COMPLETE
92,0.36540186631121674,2026-06-13 23:13:56.613705,2026-06-13 23:13:58.528542,0 days 00:00:01.914837,0.0004707214222806762,entropy,14,0.9855323889744303,0.00022037023565761309,18,17,COMPLETE
93,0.3546249400397471,2026-06-13 23:13:58.529427,2026-06-13 23:14:00.174205,0 days 00:00:01.644778,0.00011893997802152147,entropy,15,0.9563549112215799,0.0008784258030407607,7,15,COMPLETE
94,0.3626452952545903,2026-06-13 23:14:00.174679,2026-06-13 23:14:01.819333,0 days 00:00:01.644654,0.0002824800956894137,entropy,14,0.9415951628506166,0.0005332920496907003,16,17,COMPLETE
95,0.3414171877705532,2026-06-13 23:14:01.820333,2026-06-13 23:14:03.341377,0 days 00:00:01.521044,8.814497754845324e-06,entropy,15,0.9704353366698137,0.0010989861745082819,18,16,COMPLETE
96,0.36301427990432333,2026-06-13 23:14:03.341862,2026-06-13 23:14:05.146397,0 days 00:00:01.804535,0.0005350062934200654,entropy,13,0.8969979552270617,0.00021110821169272154,15,15,COMPLETE
97,0.35857863403850176,2026-06-13 23:14:05.147045,2026-06-13 23:14:06.806585,0 days 00:00:01.659540,0.00028051081287342854,entropy,14,0.9861450883850988,0.0007649470495912998,17,18,COMPLETE
98,0.2971734667595475,2026-06-13 23:14:06.807066,2026-06-13 23:14:07.910507,0 days 00:00:01.103441,0.004311495509834572,entropy,3,0.9364628281299059,1.3765717615421867e-05,14,14,COMPLETE
99,0.3397125736429233,2026-06-13 23:14:07.910933,2026-06-13 23:14:09.180416,0 days 00:00:01.269483,0.000667578105005068,gini,9,0.9527814501478917,0.0005787643712374281,17,17,COMPLETE
100,0.33484588675031934,2026-06-13 23:14:09.181020,2026-06-13 23:14:10.664881,0 days 00:00:01.483861,0.0003943324843811007,entropy,6,0.9679552861307549,0.0017756371726725113,2,19,COMPLETE
101,0.3757431830844683,2026-06-13 23:14:10.665766,2026-06-13 23:14:12.537105,0 days 00:00:01.871339,0.00023623366421226586,entropy,14,0.956864457609942,0.00026773078288133337,19,17,COMPLETE
102,0.3759637958611054,2026-06-13 23:14:12.537585,2026-06-13 23:14:14.392079,0 days 00:00:01.854494,0.00010717591011886676,entropy,14,0.9868763920287239,0.0002723703836990432,19,16,COMPLETE
103,0.3767131738368324,2026-06-13 23:14:14.394456,2026-06-13 23:14:16.187406,0 days 00:00:01.792950,9.23149024169445e-05,entropy,14,0.9170398364521581,0.0002450310549911503,19,16,COMPLETE
104,0.37865045940492287,2026-06-13 23:14:16.188294,2026-06-13 23:14:18.072453,0 days 00:00:01.884159,8.52051968907128e-05,entropy,13,0.915582896593296,0.00021343317619094314,19,17,COMPLETE
105,0.3545751908259076,2026-06-13 23:14:18.072980,2026-06-13 23:14:19.617239,0 days 00:00:01.544259,0.0002409538108488797,entropy,13,0.9170202723850394,0.0008509972780698291,19,17,COMPLETE
106,0.3602550362873435,2026-06-13 23:14:19.617937,2026-06-13 23:14:21.160468,0 days 00:00:01.542531,0.00039769370179891435,entropy,14,0.9018452371724561,0.0005992869254780818,20,18,COMPLETE
107,0.3380779000577192,2026-06-13 23:14:21.162722,2026-06-13 23:14:22.599056,0 days 00:00:01.436334,0.0005047878864621057,entropy,13,0.8856487266074881,0.0011966509774761697,19,17,COMPLETE
108,0.38040203800194616,2026-06-13 23:14:22.599879,2026-06-13 23:14:24.398830,0 days 00:00:01.798951,8.626583496089239e-05,entropy,14,0.8544030243802654,0.00016582276206808392,20,16,COMPLETE
109,0.3757598064345015,2026-06-13 23:14:24.399591,2026-06-13 23:14:26.277946,0 days 00:00:01.878355,0.0002559443198477246,entropy,14,0.8533088614858846,9.455060979803297e-05,20,19,COMPLETE
110,0.3807178081531202,2026-06-13 23:14:26.278378,2026-06-13 23:14:28.066070,0 days 00:00:01.787692,8.512937435826865e-05,entropy,14,0.8559717167532515,0.00017317066027785864,20,19,COMPLETE
111,0.38321293037734805,2026-06-13 23:14:28.066862,2026-06-13 23:14:29.865820,0 days 00:00:01.798958,8.451874330260631e-05,entropy,14,0.8526340226369903,0.00014615861036686587,20,19,COMPLETE
112,0.36323454721034365,2026-06-13 23:14:29.866499,2026-06-13 23:14:31.411855,0 days 00:00:01.545356,5.7666340416565325e-05,entropy,13,0.8485374728242147,0.00047894867714136347,20,20,COMPLETE
113,0.38655967071610403,2026-06-13 23:14:31.412360,2026-06-13 23:14:33.288754,0 days 00:00:01.876394,0.00011616416490384673,entropy,14,0.8246649568652614,9.503672840671747e-05,20,19,COMPLETE
114,0.360585074768035,2026-06-13 23:14:33.289329,2026-06-13 23:14:34.711938,0 days 00:00:01.422609,0.0001349310827871494,entropy,14,0.8083890732032248,0.0004935783962761707,20,19,COMPLETE
