number,value,datetime_start,datetime_complete,duration,params_ccp_alpha,params_criterion,params_max_depth,params_max_features,params_min_impurity_decrease,params_min_samples_leaf,params_min_samples_split,state
115,0.252806294084985,2026-06-13 23:11:27.255875,2026-06-13 23:11:28.365900,0 days 00:00:01.110025,0.004941871121086693,gini,11,0.8798225487025617,0.0004259657655690816,11,14,COMPLETE
116,0.38633063087006014,2026-06-13 23:11:28.366651,2026-06-13 23:11:29.791246,0 days 00:00:01.424595,0.00011158598641181026,gini,12,0.8662401664252262,3.889120890966373e-05,14,16,COMPLETE
117,0.3431259215373349,2026-06-13 23:11:29.791690,2026-06-13 23:11:30.828466,0 days 00:00:01.036776,0.0003671933285966111,gini,12,0.8305735478499344,0.0006924613387733981,11,17,COMPLETE
118,0.3534863251593599,2026-06-13 23:11:30.829193,2026-06-13 23:11:31.993873,0 days 00:00:01.164680,0.0005399903288438211,gini,13,0.8023649021718329,0.00020424162857443347,13,18,COMPLETE
119,0.361737099370714,2026-06-13 23:11:31.994369,2026-06-13 23:11:33.094247,0 days 00:00:01.099878,5.254017533120058e-06,gini,12,0.9236920025799732,0.00040175794615214457,14,14,COMPLETE
120,0.30316419642893316,2026-06-13 23:11:33.094703,2026-06-13 23:11:34.754904,0 days 00:00:01.660201,0.0020570846210337355,gini,13,0.8402375125330817,7.720488537378073e-06,14,13,COMPLETE
