number,value,datetime_start,datetime_complete,duration,params_ccp_alpha,params_criterion,params_max_depth,params_max_features,params_min_impurity_decrease,params_min_samples_leaf,params_min_samples_split,state
115,0.3999478269569524,2026-07-12 19:32:14.516495,2026-07-12 19:32:16.649452,0 days 00:00:02.132957,0.00015134392297199011,entropy,14,0.7053914214533487,2.419348261033477e-05,10,18,COMPLETE
116,0.3879918642879613,2026-07-12 19:32:16.650020,2026-07-12 19:32:18.211211,0 days 00:00:01.561191,0.00013810334190794677,gini,14,0.6991444113240929,0.00012404282882539996,10,18,COMPLETE
117,0.38188901581997764,2026-07-12 19:32:18.211456,2026-07-12 19:32:20.228230,0 days 00:00:02.016774,0.00022429947345358755,gini,14,0.6955545309344263,1.5048209343744995e-05,10,19,COMPLETE
118,0.3506942851726227,2026-07-12 19:32:20.228544,2026-07-12 19:32:21.539188,0 days 00:00:01.310644,0.00015389973731126422,gini,14,0.7059742516999926,0.0008372173299440668,12,18,COMPLETE
119,0.37485022936973134,2026-07-12 19:32:21.539480,2026-07-12 19:32:23.106722,0 days 00:00:01.567242,0.0002539118005198363,gini,13,0.6937317268875102,0.00018521446760103507,9,19,COMPLETE
120,0.35497061897960724,2026-07-12 19:32:23.106971,2026-07-12 19:32:24.495871,0 days 00:00:01.388900,0.00013103754317914397,gini,14,0.7322235329500733,0.0007194639638088161,10,18,COMPLETE
121,0.37085649000680465,2026-07-12 19:32:24.496275,2026-07-12 19:32:26.246980,0 days 00:00:01.750705,0.00039600351305904086,gini,14,0.6842012006114115,3.817002845261003e-05,10,17,COMPLETE
122,0.37693715922039106,2026-07-12 19:32:26.247286,2026-07-12 19:32:28.280283,0 days 00:00:02.032997,0.00026465382781359854,gini,14,0.705280174912125,1.5201355629712664e-05,11,16,COMPLETE
123,0.3576796275444768,2026-07-12 19:32:28.280545,2026-07-12 19:32:29.622075,0 days 00:00:01.341530,0.00013825395327414378,gini,13,0.62806667076301,0.0004569245525694758,11,18,COMPLETE
124,0.3626923574417537,2026-07-12 19:32:29.622303,2026-07-12 19:32:31.109909,0 days 00:00:01.487606,0.0004469490002160546,gini,14,0.6435766110551706,0.00022193440805501552,9,19,COMPLETE
125,0.3662401724608332,2026-07-12 19:32:31.110134,2026-07-12 19:32:32.536222,0 days 00:00:01.426088,0.0003176948165425448,gini,15,0.8072242771678549,0.00040020025338688425,10,20,COMPLETE
126,0.2727721958046533,2026-07-12 19:32:32.536546,2026-07-12 19:32:33.617774,0 days 00:00:01.081228,0.0002133399868763301,gini,14,0.763353514625803,0.00510375144650788,8,15,COMPLETE
127,0.37204355909031844,2026-07-12 19:32:33.618102,2026-07-12 19:32:35.240273,0 days 00:00:01.622171,0.00040063044483051603,gini,13,0.7171665107256407,0.0001772965005625338,17,17,COMPLETE
128,0.3558417703210253,2026-07-12 19:32:35.240616,2026-07-12 19:32:36.538711,0 days 00:00:01.298095,7.289483929349246e-05,gini,15,0.7003898692292887,0.0006115365527765093,9,16,COMPLETE
129,0.37192556081885453,2026-07-12 19:32:36.538930,2026-07-12 19:32:38.528742,0 days 00:00:01.989812,0.0006485764790430158,entropy,14,0.6714991501650022,1.3464856012602895e-05,11,19,COMPLETE
130,0.3550166350243945,2026-07-12 19:32:38.528996,2026-07-12 19:32:39.849983,0 days 00:00:01.320987,0.0003067580831632084,entropy,15,0.651859449521178,0.0009599698587269395,8,15,COMPLETE
131,0.3810890626091716,2026-07-12 19:32:39.850303,2026-07-12 19:32:41.397412,0 days 00:00:01.547109,0.0004630928132403205,entropy,15,0.6804382444303835,0.0002820541966763344,10,17,COMPLETE
132,0.38133223286068996,2026-07-12 19:32:41.397685,2026-07-12 19:32:43.478465,0 days 00:00:02.080780,0.00047322252646223354,entropy,15,0.6876666321772346,4.0511259475152e-06,10,17,COMPLETE
133,0.37747223125412666,2026-07-12 19:32:43.478798,2026-07-12 19:32:44.932579,0 days 00:00:01.453781,0.0004828103426205502,entropy,14,0.6862016612009424,0.0003617819044403141,9,17,COMPLETE
134,0.39257520741439655,2026-07-12 19:32:44.932880,2026-07-12 19:32:46.456688,0 days 00:00:01.523808,0.00023458799396452364,entropy,15,0.7132990408178237,0.00023436783992369025,12,18,COMPLETE
135,0.37678278047400054,2026-07-12 19:32:46.457086,2026-07-12 19:32:47.905487,0 days 00:00:01.448401,0.00011862346099377402,entropy,14,0.6586815869164364,0.0004759215686978736,12,18,COMPLETE
136,0.389908641463424,2026-07-12 19:32:47.905732,2026-07-12 19:32:49.528350,0 days 00:00:01.622618,0.0002302004551916794,entropy,15,0.6936894919282998,0.00024145701170118818,11,19,COMPLETE
137,0.36968682898703975,2026-07-12 19:32:49.528626,2026-07-12 19:32:50.910748,0 days 00:00:01.382122,0.00024041349482022636,entropy,15,0.7111536343496381,0.0007507867270728382,12,19,COMPLETE
138,0.36902998314478624,2026-07-12 19:32:50.911130,2026-07-12 19:32:52.365510,0 days 00:00:01.454380,8.497998586519056e-05,gini,15,0.6945815187739182,0.0002698197389768202,13,18,COMPLETE
139,0.37927027533984803,2026-07-12 19:32:52.365796,2026-07-12 19:32:53.931490,0 days 00:00:01.565694,0.0003499643921787591,entropy,15,0.732037287489381,0.0005782681977413841,12,19,COMPLETE
140,0.3778615011651012,2026-07-12 19:32:53.931759,2026-07-12 19:32:55.477647,0 days 00:00:01.545888,0.0003451612461048828,entropy,15,0.728806176047435,0.0005645844502029317,14,20,COMPLETE
141,0.38563585558291924,2026-07-12 19:32:55.477970,2026-07-12 19:32:56.990506,0 days 00:00:01.512536,0.00021075639487551,entropy,15,0.6800383417919815,0.0002948134063128008,12,19,COMPLETE
142,0.3831804258994982,2026-07-12 19:32:56.990750,2026-07-12 19:32:58.525770,0 days 00:00:01.535020,7.034282670935948e-06,entropy,15,0.6742839468313835,0.00030545689876542093,14,19,COMPLETE
143,0.38619421718671304,2026-07-12 19:32:58.526076,2026-07-12 19:33:00.134439,0 days 00:00:01.608363,0.00018683753862501777,entropy,15,0.6792421822540338,0.00027059163673572885,14,18,COMPLETE
144,0.3821820513917674,2026-07-12 19:33:00.134763,2026-07-12 19:33:01.714329,0 days 00:00:01.579566,0.00017229742855974256,entropy,15,0.6678627682376428,0.00031286444599461124,16,18,COMPLETE
145,0.3823056732808861,2026-07-12 19:33:01.714802,2026-07-12 19:33:03.211634,0 days 00:00:01.496832,0.00018156745131396205,entropy,15,0.6669651866406269,0.0003188488824911297,16,18,COMPLETE
146,0.3614217269117611,2026-07-12 19:33:03.211906,2026-07-12 19:33:04.510431,0 days 00:00:01.298525,3.076886871653149e-05,entropy,15,0.6212749242277638,0.001096367466762107,16,19,COMPLETE
147,0.36078920548942356,2026-07-12 19:33:04.510767,2026-07-12 19:33:05.929094,0 days 00:00:01.418327,0.0001788567406496612,entropy,15,0.6681355812210442,0.0008917382644353526,15,20,COMPLETE
148,0.38195398847994494,2026-07-12 19:33:05.929381,2026-07-12 19:33:07.444172,0 days 00:00:01.514791,9.489704100354955e-07,entropy,15,0.7000444125626203,0.0004017129622921999,17,18,COMPLETE
149,0.36437749005469666,2026-07-12 19:33:07.444508,2026-07-12 19:33:08.774180,0 days 00:00:01.329672,1.656964368603798e-07,entropy,15,0.6419293854035522,0.0007579027177647493,16,18,COMPLETE
150,0.3726575541795377,2026-07-12 19:33:08.774489,2026-07-12 19:33:10.397245,0 days 00:00:01.622756,0.0001735578860213878,gini,15,0.9357552820639476,0.0003450695172220153,17,19,COMPLETE
151,0.37794817168598027,2026-07-12 19:33:10.397525,2026-07-12 19:33:12.003540,0 days 00:00:01.606015,0.00010977197696637133,entropy,15,0.7080730227867649,0.00042789326622946875,15,18,COMPLETE
152,0.38981492004445295,2026-07-12 19:33:12.003847,2026-07-12 19:33:13.460442,0 days 00:00:01.456595,0.00025303246616690134,entropy,15,0.697945813781603,0.0002404202111314118,18,19,COMPLETE
153,0.38495894483954574,2026-07-12 19:33:13.460683,2026-07-12 19:33:14.804735,0 days 00:00:01.344052,0.00022526154990065015,entropy,15,0.6649825899802017,0.0002864688167708948,17,19,COMPLETE
154,0.387472067104271,2026-07-12 19:33:14.805106,2026-07-12 19:33:16.239476,0 days 00:00:01.434370,0.00022014397915808887,entropy,15,0.6648220219134781,0.00026971115008314736,19,20,COMPLETE
155,0.370832458566228,2026-07-12 19:33:16.239692,2026-07-12 19:33:17.683389,0 days 00:00:01.443697,6.193472676524797e-06,entropy,15,0.6637999663026769,0.0006514592593589207,18,19,COMPLETE
156,0.3922947226942956,2026-07-12 19:33:17.683651,2026-07-12 19:33:19.393030,0 days 00:00:01.709379,0.00022397675535168373,entropy,15,0.7169212655591604,0.000234224829936036,19,20,COMPLETE
157,0.3662693150550396,2026-07-12 19:33:19.393351,2026-07-12 19:33:20.820980,0 days 00:00:01.427629,0.00011579696383363708,entropy,15,0.7160729902314796,0.000931471609198199,20,20,COMPLETE
158,0.3823056732808861,2026-07-12 19:33:20.821236,2026-07-12 19:33:22.375887,0 days 00:00:01.554651,0.0002483931152225047,entropy,15,0.6682251839034767,0.0003181250199491297,19,20,COMPLETE
159,0.38831771153392797,2026-07-12 19:33:22.376184,2026-07-12 19:33:24.085137,0 days 00:00:01.708953,0.0002568022334582617,entropy,15,0.6392332586399152,0.0002620141891089044,19,20,COMPLETE
160,0.37087629156255325,2026-07-12 19:33:24.085493,2026-07-12 19:33:25.531109,0 days 00:00:01.445616,0.00026979126279193694,entropy,15,0.6299936657014777,0.0005551655940596197,19,20,COMPLETE
161,0.3887721403177814,2026-07-12 19:33:25.531354,2026-07-12 19:33:27.086569,0 days 00:00:01.555215,0.00021582981534817476,entropy,15,0.6461699685676796,0.00027035258817857894,18,20,COMPLETE
162,0.3868675750448682,2026-07-12 19:33:27.086910,2026-07-12 19:33:28.717950,0 days 00:00:01.631040,0.00028389472862122724,entropy,15,0.6526214010632835,0.0002611036041871222,18,20,COMPLETE
163,0.38737692633475407,2026-07-12 19:33:28.718239,2026-07-12 19:33:30.317292,0 days 00:00:01.599053,0.0003058216534100671,entropy,15,0.6553117599580279,0.0002292328643217527,18,20,COMPLETE
164,0.3671193250356203,2026-07-12 19:33:30.317622,2026-07-12 19:33:31.718033,0 days 00:00:01.400411,0.00031750020872175014,entropy,15,0.6483975094635901,0.0007074633622360007,18,20,COMPLETE
165,0.38658166974198427,2026-07-12 19:33:31.719253,2026-07-12 19:33:33.245818,0 days 00:00:01.526565,9.181405074602442e-05,entropy,15,0.6148364351801782,0.00022532746643082023,18,20,COMPLETE
166,0.3709743921324629,2026-07-12 19:33:33.246137,2026-07-12 19:33:34.742362,0 days 00:00:01.496225,0.0002739858777253845,entropy,15,0.6356346895024865,0.0005477181968437226,18,20,COMPLETE
167,0.39014769916751474,2026-07-12 19:33:34.742686,2026-07-12 19:33:36.423901,0 days 00:00:01.681215,0.00011043682615349613,entropy,15,0.6216173348324452,0.00022892312163713322,19,20,COMPLETE
168,0.36697724424881006,2026-07-12 19:33:36.424278,2026-07-12 19:33:37.821815,0 days 00:00:01.397537,0.00011508568185567983,entropy,15,0.6403834288214868,0.0008262540477579961,19,20,COMPLETE
169,0.3866655042940592,2026-07-12 19:33:37.822136,2026-07-12 19:33:39.342680,0 days 00:00:01.520544,0.0003491752880903226,entropy,15,0.6215520051819032,0.0002118403435386176,18,20,COMPLETE
170,0.38497815454968753,2026-07-12 19:33:39.342980,2026-07-12 19:33:40.910903,0 days 00:00:01.567923,0.00034789060382035955,entropy,15,0.6052740478257439,0.00022200418750453185,18,20,COMPLETE
171,0.3844385287892122,2026-07-12 19:33:40.911210,2026-07-12 19:33:42.366679,0 days 00:00:01.455469,0.00036746252589193106,entropy,15,0.6156639636178682,0.00021951121680450835,18,20,COMPLETE
172,0.3744121625977028,2026-07-12 19:33:42.366994,2026-07-12 19:33:43.825795,0 days 00:00:01.458801,0.0003107355491648704,entropy,15,0.6084339776893921,0.0005503621155895592,20,20,COMPLETE
173,0.3766084187513412,2026-07-12 19:33:43.826104,2026-07-12 19:33:45.352663,0 days 00:00:01.526559,0.0001173680356749523,entropy,15,0.6213809220953909,0.00046403972379464495,18,20,COMPLETE
174,0.38420329024937017,2026-07-12 19:33:45.352998,2026-07-12 19:33:46.954397,0 days 00:00:01.601399,0.00035740580555859377,entropy,15,0.6308755048065879,0.0002692703535171892,19,19,COMPLETE
175,0.36756529697144935,2026-07-12 19:33:46.954737,2026-07-12 19:33:48.281156,0 days 00:00:01.326419,0.00022768262995349046,entropy,15,0.6525472867831172,0.0007109066462248094,19,20,COMPLETE
176,0.39194373652393544,2026-07-12 19:33:48.281429,2026-07-12 19:33:49.653053,0 days 00:00:01.371624,9.511188037021273e-05,entropy,15,0.5806954249046128,0.0001852340455669714,18,19,COMPLETE
177,0.39328715702054895,2026-07-12 19:33:49.653370,2026-07-12 19:33:51.037689,0 days 00:00:01.384319,8.078395891668327e-05,entropy,14,0.5818729695249558,0.00017072482287583022,19,19,COMPLETE
178,0.3939515960488873,2026-07-12 19:33:51.037913,2026-07-12 19:33:52.475158,0 days 00:00:01.437245,9.51462739178655e-05,entropy,14,0.6147149538292142,0.00015894395489644332,20,19,COMPLETE
179,0.37576791419046807,2026-07-12 19:33:52.475468,2026-07-12 19:33:53.655753,0 days 00:00:01.180285,7.565856058204507e-05,entropy,14,0.5751266705649163,0.0004993058913438144,19,19,COMPLETE
180,0.3932535862120166,2026-07-12 19:33:53.656079,2026-07-12 19:33:55.113596,0 days 00:00:01.457517,8.895333956698343e-05,entropy,14,0.6236749423651227,0.00018152826418412166,20,19,COMPLETE
181,0.3919219882681496,2026-07-12 19:33:55.113970,2026-07-12 19:33:56.429804,0 days 00:00:01.315834,0.00011002193496619296,entropy,14,0.5905261479480958,0.00018255685663153505,18,19,COMPLETE
182,0.3877754275426652,2026-07-12 19:33:56.430070,2026-07-12 19:33:57.759923,0 days 00:00:01.329853,8.851244327189771e-05,entropy,14,0.5947575388275415,0.00019922914037219866,20,19,COMPLETE
183,0.3760582432998932,2026-07-12 19:33:57.760193,2026-07-12 19:33:59.018205,0 days 00:00:01.258012,9.920507006597727e-05,entropy,14,0.5883906803832377,0.00044518418112973767,20,19,COMPLETE
184,0.3941869803930925,2026-07-12 19:33:59.018452,2026-07-12 19:34:00.458629,0 days 00:00:01.440177,0.0001133757688694056,entropy,14,0.579251399738982,0.0001757675821800056,20,19,COMPLETE
185,0.3919219882681496,2026-07-12 19:34:00.458882,2026-07-12 19:34:01.891025,0 days 00:00:01.432143,6.238544509977462e-09,entropy,14,0.5774423852686371,0.0001820916466713106,20,19,COMPLETE
186,0.37042403056627354,2026-07-12 19:34:01.891350,2026-07-12 19:34:03.115745,0 days 00:00:01.224395,7.167313152733326e-06,entropy,14,0.5653114308453917,0.0005933817366601598,20,19,COMPLETE
187,0.3958211083380953,2026-07-12 19:34:03.115992,2026-07-12 19:34:04.659415,0 days 00:00:01.543423,0.00012233297197598118,entropy,14,0.5885954112151348,0.0001669546763294223,20,19,COMPLETE
188,0.3952799615660309,2026-07-12 19:34:04.659688,2026-07-12 19:34:06.270926,0 days 00:00:01.611238,9.306770267136698e-05,entropy,14,0.5840724117203714,0.00013628139263648274,20,19,COMPLETE
189,0.37575589565039336,2026-07-12 19:34:06.271180,2026-07-12 19:34:07.771577,0 days 00:00:01.500397,0.00011654387351932192,entropy,14,0.5726840857031082,0.0004861117984979994,20,19,COMPLETE
190,0.39693343507789075,2026-07-12 19:34:07.771861,2026-07-12 19:34:09.276591,0 days 00:00:01.504730,8.055554280625484e-05,entropy,14,0.5811212417066891,0.0001349368421558698,20,19,COMPLETE
191,0.3961111681579102,2026-07-12 19:34:09.276918,2026-07-12 19:34:10.587197,0 days 00:00:01.310279,1.0590790986649774e-05,entropy,14,0.5811298360776309,0.00014216150554852654,20,19,COMPLETE
192,0.3806337017658709,2026-07-12 19:34:10.587572,2026-07-12 19:34:12.198242,0 days 00:00:01.610670,2.904764000736615e-06,entropy,14,0.5866645412213787,3.98111381884217e-06,20,19,COMPLETE
193,0.3952840933641927,2026-07-12 19:34:12.198579,2026-07-12 19:34:13.495859,0 days 00:00:01.297280,1.4762163147568079e-06,entropy,14,0.5800854289004157,0.00014475004061105187,19,19,COMPLETE
194,0.39720234021363277,2026-07-12 19:34:13.496130,2026-07-12 19:34:14.809039,0 days 00:00:01.312909,1.7958105760461634e-06,entropy,13,0.5805986986554332,0.00014099379238859838,20,19,COMPLETE
195,0.3097410264818982,2026-07-12 19:34:14.809321,2026-07-12 19:34:15.795416,0 days 00:00:00.986095,6.349265359288311e-06,entropy,13,0.5799516252759299,0.004104848802016034,20,19,COMPLETE
196,0.39771125463954726,2026-07-12 19:34:15.795689,2026-07-12 19:34:17.087397,0 days 00:00:01.291708,9.853081697089647e-05,entropy,13,0.5577859637260115,0.0001337627866943211,20,19,COMPLETE
197,0.36687419980164615,2026-07-12 19:34:17.087750,2026-07-12 19:34:18.195578,0 days 00:00:01.107828,9.469452119714103e-05,entropy,13,0.5618270849081407,0.0004971510780983877,20,19,COMPLETE
198,0.4000520998503183,2026-07-12 19:34:18.195808,2026-07-12 19:34:19.811796,0 days 00:00:01.615988,9.63697929473078e-05,entropy,13,0.5785829105241868,3.409099315918344e-06,20,18,COMPLETE
199,0.3987812238972584,2026-07-12 19:34:19.812038,2026-07-12 19:34:21.149931,0 days 00:00:01.337893,5.428826001586243e-06,entropy,13,0.5774148398384661,0.00012444114666618954,20,18,COMPLETE
200,0.4033658221541615,2026-07-12 19:34:21.150277,2026-07-12 19:34:22.565480,0 days 00:00:01.415203,2.304981219574465e-05,entropy,13,0.5700521845672086,4.642748227658293e-05,20,18,COMPLETE
201,0.40040960713119056,2026-07-12 19:34:22.565889,2026-07-12 19:34:24.063043,0 days 00:00:01.497154,1.4397161437685044e-05,entropy,13,0.5781058337642518,3.3844874309085196e-05,20,18,COMPLETE
202,0.39915240159503396,2026-07-12 19:34:24.063353,2026-07-12 19:34:25.358106,0 days 00:00:01.294753,9.26014099169703e-05,entropy,13,0.5561592837034733,9.251643364652345e-05,20,18,COMPLETE
203,0.38669353896295655,2026-07-12 19:34:25.358371,2026-07-12 19:34:26.913729,0 days 00:00:01.555358,6.802141334925012e-06,entropy,13,0.5539215213989889,8.69062485326627e-06,20,18,COMPLETE
204,0.3970431472813216,2026-07-12 19:34:26.914027,2026-07-12 19:34:28.273159,0 days 00:00:01.359132,0.00014611555289065472,entropy,13,0.5695364748531795,6.560026456706507e-05,20,18,COMPLETE
205,0.3695281541752482,2026-07-12 19:34:28.273426,2026-07-12 19:34:29.512050,0 days 00:00:01.238624,0.0001581083336417281,entropy,13,0.5450918132630307,0.00045037297829040587,20,18,COMPLETE
206,0.39362621110641527,2026-07-12 19:34:29.512289,2026-07-12 19:34:31.324330,0 days 00:00:01.812041,0.00016165881901591527,entropy,13,0.5669515385220631,3.0309820961760843e-05,20,18,COMPLETE
207,0.39431570609337674,2026-07-12 19:34:31.324583,2026-07-12 19:34:33.141389,0 days 00:00:01.816806,6.457835210345691e-06,entropy,13,0.5347780401820721,2.079874969448008e-05,20,18,COMPLETE
208,0.4014733479985414,2026-07-12 19:34:33.141662,2026-07-12 19:34:34.968461,0 days 00:00:01.826799,2.6949353244979046e-06,entropy,13,0.5303844852958252,4.754130784234481e-05,20,18,COMPLETE
209,0.40086209426282543,2026-07-12 19:34:34.968792,2026-07-12 19:34:36.923047,0 days 00:00:01.954255,6.627536158561349e-05,entropy,13,0.5340965581740895,8.415593475599698e-06,20,18,COMPLETE
210,0.3904529646415707,2026-07-12 19:34:36.923362,2026-07-12 19:34:38.877233,0 days 00:00:01.953871,2.050883580266074e-05,entropy,13,0.5283422592544775,2.607567766818624e-07,20,18,COMPLETE
211,0.40216045241818266,2026-07-12 19:34:38.877457,2026-07-12 19:34:40.499445,0 days 00:00:01.621988,9.505832802715852e-06,entropy,13,0.5405129421287849,4.675435469903173e-05,20,18,COMPLETE
212,0.4000202968602535,2026-07-12 19:34:40.499675,2026-07-12 19:34:42.052624,0 days 00:00:01.552949,8.973008796285596e-08,entropy,13,0.5584030899531272,9.332680985115527e-05,20,17,COMPLETE
213,0.39877905830076615,2026-07-12 19:34:42.053505,2026-07-12 19:34:43.606796,0 days 00:00:01.553291,2.996830774103541e-05,entropy,13,0.515401521156713,8.12354025769832e-05,20,17,COMPLETE
214,0.37390745860184105,2026-07-12 19:34:43.607015,2026-07-12 19:34:45.021093,0 days 00:00:01.414078,2.281480292085581e-06,entropy,13,0.5391525835634406,0.0004696041708757646,20,17,COMPLETE
215,0.3885924741717671,2026-07-12 19:34:45.021359,2026-07-12 19:34:46.757662,0 days 00:00:01.736303,1.2286847052279032e-06,entropy,13,0.5118140578413751,6.452660974888726e-06,20,18,COMPLETE
216,0.3759058336995753,2026-07-12 19:34:46.757950,2026-07-12 19:34:48.197843,0 days 00:00:01.439893,0.0001312225457037241,entropy,13,0.5310125791529686,0.000428290659647851,20,17,COMPLETE
217,0.40110849867676085,2026-07-12 19:34:48.198327,2026-07-12 19:34:49.826430,0 days 00:00:01.628103,5.332426350853072e-07,entropy,13,0.5523682230595488,5.813017338779256e-05,20,18,COMPLETE
218,0.31420877162502947,2026-07-12 19:34:49.826687,2026-07-12 19:34:51.470445,0 days 00:00:01.643758,0.004272709221851006,entropy,13,0.5509239253126456,1.2582020527394098e-05,19,18,COMPLETE
219,0.39762904831185564,2026-07-12 19:34:51.470749,2026-07-12 19:34:53.000662,0 days 00:00:01.529913,1.0103705930664422e-05,entropy,13,0.5162765393400611,2.3303808694363228e-05,20,17,COMPLETE
220,0.3751400211851251,2026-07-12 19:34:53.001000,2026-07-12 19:34:54.309838,0 days 00:00:01.308838,0.00015713734317746806,entropy,13,0.5166626201668535,0.0004090224796432871,20,17,COMPLETE
221,0.3978111752196415,2026-07-12 19:34:54.310137,2026-07-12 19:34:55.966108,0 days 00:00:01.655971,5.962444808339868e-07,entropy,13,0.5392356267298277,2.4176793011626696e-05,20,18,COMPLETE
222,0.3930729785096345,2026-07-12 19:34:55.966468,2026-07-12 19:34:57.621506,0 days 00:00:01.655038,5.841809492650462e-06,entropy,13,0.5559617720519107,1.8007128844902215e-05,20,18,COMPLETE
223,0.394109682389986,2026-07-12 19:34:57.621722,2026-07-12 19:34:59.293070,0 days 00:00:01.671348,0.00017296900388798483,entropy,13,0.543400524021422,2.7141288318103336e-05,19,17,COMPLETE
224,0.37048801620607097,2026-07-12 19:34:59.293291,2026-07-12 19:35:00.649021,0 days 00:00:01.355730,2.2530969442159676e-06,entropy,13,0.5633800643018484,0.00044200460706019526,20,17,COMPLETE
225,0.39944835691876823,2026-07-12 19:35:00.649278,2026-07-12 19:35:02.318056,0 days 00:00:01.668778,0.00010295276471141488,entropy,13,0.5577913677355634,3.666214898331052e-06,20,18,COMPLETE
226,0.3769724525802402,2026-07-12 19:35:02.318355,2026-07-12 19:35:03.672510,0 days 00:00:01.354155,9.288553193881639e-05,entropy,13,0.5558357582365331,0.0003772352790172838,20,18,COMPLETE
227,0.3925918095142452,2026-07-12 19:35:03.672790,2026-07-12 19:35:05.039028,0 days 00:00:01.366238,0.00017097258976836417,entropy,13,0.567535208268667,0.00016135568802145718,19,18,COMPLETE
228,0.377997473974283,2026-07-12 19:35:05.039341,2026-07-12 19:35:06.280411,0 days 00:00:01.241070,7.846151380986367e-05,entropy,13,0.5243825978462106,0.0003980547598725915,20,17,COMPLETE
