number,value,datetime_start,datetime_complete,duration,params_ccp_alpha,params_criterion,params_max_depth,params_max_features,params_min_impurity_decrease,params_min_samples_leaf,params_min_samples_split,state
229,0.3969278238906952,2026-07-12 19:35:06.280757,2026-07-12 19:35:07.892547,0 days 00:00:01.611790,1.470557700929679e-07,entropy,12,0.5381579661813832,2.597678138889189e-05,19,18,COMPLETE
230,0.3916713766864886,2026-07-12 19:35:07.892784,2026-07-12 19:35:09.581628,0 days 00:00:01.688844,3.4012744120284483e-06,entropy,12,0.5426463250505393,2.839650504366635e-06,19,18,COMPLETE
231,0.3928763806866595,2026-07-12 19:35:09.581913,2026-07-12 19:35:11.013191,0 days 00:00:01.431278,9.37582952370969e-05,entropy,12,0.5355868065476658,0.00015418186524635436,20,18,COMPLETE
232,0.3939919738159605,2026-07-12 19:35:11.013508,2026-07-12 19:35:12.696963,0 days 00:00:01.683455,0.00017717228504000388,entropy,13,0.5546960131295621,2.3960550210920832e-05,20,18,COMPLETE
233,0.3826677898874475,2026-07-12 19:35:12.697275,2026-07-12 19:35:14.065779,0 days 00:00:01.368504,2.25244401321042e-07,entropy,13,0.5716805122279558,0.00037512038144972657,19,17,COMPLETE
234,0.304693081642573,2026-07-12 19:35:14.066012,2026-07-12 19:35:15.074907,0 days 00:00:01.008895,0.00015104276944122064,entropy,13,0.5197847650779278,0.009016776507451646,20,18,COMPLETE
235,0.39330741601866565,2026-07-12 19:35:15.075179,2026-07-12 19:35:16.484098,0 days 00:00:01.408919,8.528736807476871e-05,entropy,12,0.5465213710058571,0.00016577814492939606,20,17,COMPLETE
236,0.3890678381022698,2026-07-12 19:35:16.484330,2026-07-12 19:35:17.900948,0 days 00:00:01.416618,0.000172593599408751,entropy,13,0.562218051143491,0.0001758247112742689,19,18,COMPLETE
237,0.3859059534582618,2026-07-12 19:35:17.901201,2026-07-12 19:35:19.508127,0 days 00:00:01.606926,2.531016800042321e-06,entropy,13,0.5063553148152614,6.160517924699922e-06,20,17,COMPLETE
238,0.37588992797533205,2026-07-12 19:35:19.508361,2026-07-12 19:35:20.811288,0 days 00:00:01.302927,0.00021172996063307457,entropy,13,0.532617301093906,0.0003695815758604475,20,18,COMPLETE
239,0.37210092560898256,2026-07-12 19:35:20.811538,2026-07-12 19:35:22.143837,0 days 00:00:01.332299,0.00012460140292955174,entropy,12,0.5701085097195692,0.0006041353956718231,19,18,COMPLETE
240,0.40138977586308117,2026-07-12 19:35:22.144065,2026-07-12 19:35:23.832122,0 days 00:00:01.688057,8.735647763861454e-05,entropy,13,0.5974437393928044,5.9098502209796396e-06,20,18,COMPLETE
241,0.40463247369344246,2026-07-12 19:35:23.832448,2026-07-12 19:35:25.666052,0 days 00:00:01.833604,8.505276336886387e-05,entropy,13,0.5965717379553447,1.5694053656924175e-05,20,18,COMPLETE
242,0.390833809421414,2026-07-12 19:35:25.666304,2026-07-12 19:35:27.142440,0 days 00:00:01.476136,7.78149799007086e-05,entropy,13,0.5999650781870964,0.00017197794769088006,20,18,COMPLETE
243,0.3829837603870692,2026-07-12 19:35:27.142775,2026-07-12 19:35:28.479190,0 days 00:00:01.336415,0.00020647287466147462,entropy,13,0.5544700629753474,0.00034588275401834835,20,18,COMPLETE
244,0.4011796888142163,2026-07-12 19:35:28.480152,2026-07-12 19:35:30.282769,0 days 00:00:01.802617,8.701118924488965e-05,entropy,13,0.5958658662615509,9.034641140057035e-06,20,17,COMPLETE
245,0.3914123218304427,2026-07-12 19:35:30.283134,2026-07-12 19:35:31.996799,0 days 00:00:01.713665,0.0002400097893726739,entropy,13,0.5980321050828805,2.336153763642303e-05,20,16,COMPLETE
246,0.37482825482395615,2026-07-12 19:35:31.997039,2026-07-12 19:35:33.288540,0 days 00:00:01.291501,0.00010692234665606192,entropy,13,0.5183510914427979,0.0003536279143171796,20,17,COMPLETE
247,0.38360672625976694,2026-07-12 19:35:33.288817,2026-07-12 19:35:34.636324,0 days 00:00:01.347507,8.689870983176165e-05,entropy,13,0.48836534186456776,0.00018901657983535103,20,17,COMPLETE
248,0.3887814488459654,2026-07-12 19:35:34.636566,2026-07-12 19:35:36.121402,0 days 00:00:01.484836,0.0001915500788749675,entropy,12,0.5422338795569754,0.0001717473032048827,20,18,COMPLETE
249,0.39116815614776484,2026-07-12 19:35:36.121741,2026-07-12 19:35:37.767176,0 days 00:00:01.645435,3.0575231292992545e-06,entropy,13,0.5685082229426257,1.8923758853507777e-05,19,17,COMPLETE
250,0.3801932800729927,2026-07-12 19:35:37.767483,2026-07-12 19:35:39.165511,0 days 00:00:01.398028,0.00025716226827297975,entropy,13,0.5994387696812802,0.00034257874366754585,20,18,COMPLETE
251,0.40263430976552267,2026-07-12 19:35:39.165735,2026-07-12 19:35:40.993676,0 days 00:00:01.827941,9.323051889892504e-05,entropy,13,0.588239725529896,2.4228720491912174e-05,20,18,COMPLETE
252,0.3838893432738675,2026-07-12 19:35:40.993902,2026-07-12 19:35:42.747353,0 days 00:00:01.753451,7.182443186463778e-08,entropy,13,0.5578159020504714,8.191299777535183e-06,19,18,COMPLETE
253,0.33161129679217066,2026-07-12 19:35:42.747624,2026-07-12 19:35:44.454491,0 days 00:00:01.706867,0.0030203456198110573,entropy,12,0.5279900594361591,6.2197122033995914e-06,20,17,COMPLETE
254,0.3805101559575077,2026-07-12 19:35:44.454784,2026-07-12 19:35:45.871774,0 days 00:00:01.416990,9.352103721751697e-05,entropy,13,0.5719637967711952,0.0003789892801990346,20,16,COMPLETE
255,0.369495948428844,2026-07-12 19:35:45.872097,2026-07-12 19:35:47.214764,0 days 00:00:01.342667,0.0001821743872681626,entropy,13,0.5904665397375572,0.0005782478334740006,19,18,COMPLETE
256,0.37969181358127146,2026-07-12 19:35:47.215061,2026-07-12 19:35:48.581547,0 days 00:00:01.366486,0.00027078564879164894,entropy,13,0.5473921047059324,0.00019974377561604676,20,17,COMPLETE
257,0.3449501824193269,2026-07-12 19:35:48.581829,2026-07-12 19:35:50.312343,0 days 00:00:01.730514,0.0019279890056650255,entropy,13,0.5758473074090277,8.37373443264584e-06,20,18,COMPLETE
258,0.3778849909264363,2026-07-12 19:35:50.312678,2026-07-12 19:35:51.636078,0 days 00:00:01.323400,7.994070607956795e-05,entropy,13,0.5626165868688253,0.0003859022429216193,19,18,COMPLETE
259,0.3877624137384099,2026-07-12 19:35:51.636345,2026-07-12 19:35:53.058671,0 days 00:00:01.422326,0.00017689481230544096,entropy,12,0.5359821348491061,0.0002314175897270326,20,17,COMPLETE
260,0.38361336477388813,2026-07-12 19:35:53.058901,2026-07-12 19:35:54.877411,0 days 00:00:01.818510,6.763548305497452e-07,entropy,13,0.6030134476916136,3.942770215477918e-06,20,18,COMPLETE
261,0.3759716225093691,2026-07-12 19:35:54.877714,2026-07-12 19:35:56.219071,0 days 00:00:01.341357,8.642712154979008e-05,entropy,13,0.5039407865868314,0.00033388012032117094,19,18,COMPLETE
262,0.38758464831466366,2026-07-12 19:35:56.219749,2026-07-12 19:35:57.978439,0 days 00:00:01.758690,0.00028946631895707136,entropy,13,0.5833429771923505,6.867937125560793e-06,20,17,COMPLETE
263,0.37210092560898256,2026-07-12 19:35:57.978776,2026-07-12 19:35:59.291120,0 days 00:00:01.312344,0.00017509197634052361,entropy,13,0.5552213295315629,0.00060500040668454,20,18,COMPLETE
264,0.3849827831691964,2026-07-12 19:35:59.291352,2026-07-12 19:36:00.658830,0 days 00:00:01.367478,8.39015027519404e-05,entropy,12,0.5401158064598588,0.00020698879432552687,19,18,COMPLETE
265,0.37048865569959,2026-07-12 19:36:00.659049,2026-07-12 19:36:01.979001,0 days 00:00:01.319952,0.0001655663553709184,entropy,13,0.5234311359585733,0.0004200557167096925,20,17,COMPLETE
266,0.27889494887345545,2026-07-12 19:36:01.979357,2026-07-12 19:36:03.036547,0 days 00:00:01.057190,9.265566583393782e-07,entropy,13,0.5683329789439846,0.007480170094525965,20,18,COMPLETE
267,0.38852039138294103,2026-07-12 19:36:03.036840,2026-07-12 19:36:04.469491,0 days 00:00:01.432651,0.0002848241334666806,entropy,13,0.5843462342203405,0.00022176696139252053,19,17,COMPLETE
268,0.403028413134124,2026-07-12 19:36:04.469845,2026-07-12 19:36:06.625231,0 days 00:00:02.155386,9.48768746845635e-05,entropy,13,0.8465738425180006,4.288250896007109e-06,20,18,COMPLETE
269,0.39692216085572973,2026-07-12 19:36:06.626175,2026-07-12 19:36:08.737072,0 days 00:00:02.110897,0.00018269235770080117,entropy,12,0.8749063496641288,1.7037473454268747e-05,20,18,COMPLETE
270,0.3769724525802402,2026-07-12 19:36:08.737299,2026-07-12 19:36:10.057353,0 days 00:00:01.320054,9.346551615326534e-05,entropy,13,0.5493490500768893,0.00038020395748913726,19,16,COMPLETE
271,0.37707483169217826,2026-07-12 19:36:10.057610,2026-07-12 19:36:11.671173,0 days 00:00:01.613563,0.00025797008211173587,entropy,13,0.9508123016091282,0.0006268093927202149,20,18,COMPLETE
272,0.3911684543575653,2026-07-12 19:36:11.671510,2026-07-12 19:36:13.329785,0 days 00:00:01.658275,9.759290815157019e-05,entropy,13,0.8323514863110946,0.0002329237408188193,20,17,COMPLETE
273,0.3793764914250708,2026-07-12 19:36:13.330173,2026-07-12 19:36:14.903587,0 days 00:00:01.573414,0.00034100295182538275,entropy,13,0.5116764228090321,5.248898779510067e-06,20,18,COMPLETE
274,0.3975263444704701,2026-07-12 19:36:14.903820,2026-07-12 19:36:16.614156,0 days 00:00:01.710336,0.00015474958893058513,entropy,12,0.5308205604270214,1.1097164768899078e-06,19,17,COMPLETE
275,0.3764271320968554,2026-07-12 19:36:16.614412,2026-07-12 19:36:17.987341,0 days 00:00:01.372929,0.0002216548452972521,entropy,13,0.5599070127056761,0.00038518079233217567,20,17,COMPLETE
276,0.39516024165290686,2026-07-12 19:36:17.987703,2026-07-12 19:36:19.786269,0 days 00:00:01.798566,0.00017241209471941063,entropy,13,0.9073779851831241,0.00020058585778696055,19,16,COMPLETE
277,0.3748287571866412,2026-07-12 19:36:19.786652,2026-07-12 19:36:21.223980,0 days 00:00:01.437328,0.0003356894034766663,entropy,13,0.5259838058258544,0.00020247998092712716,20,17,COMPLETE
278,0.3732856631099736,2026-07-12 19:36:21.224267,2026-07-12 19:36:22.611311,0 days 00:00:01.387044,0.00010389503867089378,entropy,13,0.605082281904007,0.0005259084917278502,20,17,COMPLETE
279,0.3799891742967952,2026-07-12 19:36:22.611613,2026-07-12 19:36:23.971793,0 days 00:00:01.360180,0.00018329435317941686,entropy,12,0.5475607552441976,0.00033942328360691827,20,18,COMPLETE
280,0.39501812211060255,2026-07-12 19:36:23.972038,2026-07-12 19:36:25.487810,0 days 00:00:01.515772,9.846335911159407e-05,entropy,13,0.5739066771025795,0.00017011579026772564,19,18,COMPLETE
281,0.36538298465982033,2026-07-12 19:36:25.488090,2026-07-12 19:36:26.691093,0 days 00:00:01.203003,0.00027243674756832336,entropy,13,0.49602176815717863,0.0005347153469386617,20,17,COMPLETE
282,0.39196479223788616,2026-07-12 19:36:26.691337,2026-07-12 19:36:28.137499,0 days 00:00:01.446162,6.897803695626996e-05,entropy,13,0.59221267297434,0.00019416884324257756,20,18,COMPLETE
283,0.3947024413866278,2026-07-12 19:36:28.137756,2026-07-12 19:36:29.772374,0 days 00:00:01.634618,0.00017444399225903875,entropy,12,0.5126018858140757,7.737554740251989e-06,20,17,COMPLETE
284,0.38526759671404515,2026-07-12 19:36:29.772787,2026-07-12 19:36:31.503426,0 days 00:00:01.730639,5.8751271398671705e-06,entropy,13,0.5609405333598094,7.993045630730273e-06,19,18,COMPLETE
285,0.38098297863732034,2026-07-12 19:36:31.503699,2026-07-12 19:36:32.895655,0 days 00:00:01.391956,0.0002633086217938686,entropy,13,0.5334778275923173,0.0003426774170730091,20,17,COMPLETE
286,0.35943475697778704,2026-07-12 19:36:32.895916,2026-07-12 19:36:34.222005,0 days 00:00:01.326089,0.00011604078218681042,entropy,13,0.5710838095999611,0.0007292099012997806,20,18,COMPLETE
287,0.38348744149138253,2026-07-12 19:36:34.222318,2026-07-12 19:36:35.874010,0 days 00:00:01.651692,0.00038440487624893547,entropy,13,0.8174752736141554,0.0003833898464392922,19,18,COMPLETE
288,0.3837523389071998,2026-07-12 19:36:35.874269,2026-07-12 19:36:37.314519,0 days 00:00:01.440250,9.019600356383717e-05,entropy,13,0.5491081454748986,0.00019956812606433094,20,16,COMPLETE
289,0.36538298465982033,2026-07-12 19:36:37.314770,2026-07-12 19:36:38.604453,0 days 00:00:01.289683,0.00019783817216312928,entropy,12,0.5210014822466494,0.0005338772676207747,19,17,COMPLETE
290,0.39329886520562823,2026-07-12 19:36:38.604696,2026-07-12 19:36:40.079411,0 days 00:00:01.474715,8.384429154087063e-05,entropy,13,0.5871960990779225,0.00018084805895511726,20,18,COMPLETE
291,0.37671967604211143,2026-07-12 19:36:40.080372,2026-07-12 19:36:41.547927,0 days 00:00:01.467555,4.928162373361702e-06,entropy,13,0.5634687495753693,0.00036570508211067505,19,19,COMPLETE
292,0.39016503532952607,2026-07-12 19:36:41.548200,2026-07-12 19:36:43.507114,0 days 00:00:01.958914,0.0002596390448881277,entropy,13,0.5978746740951524,1.3318776228389508e-05,20,18,COMPLETE
293,0.3840026063329719,2026-07-12 19:36:43.507395,2026-07-12 19:36:44.876163,0 days 00:00:01.368768,0.00016199196293159823,entropy,12,0.5370035903813344,0.00020104099259517179,20,17,COMPLETE
294,0.397497425536354,2026-07-12 19:36:44.876412,2026-07-12 19:36:46.595978,0 days 00:00:01.719566,5.445363786053811e-06,entropy,11,0.5775604530757704,2.8919844031815656e-07,20,18,COMPLETE
295,0.39649995146779354,2026-07-12 19:36:46.596221,2026-07-12 19:36:48.730264,0 days 00:00:02.134043,0.0001758996199097292,entropy,11,0.8561238217272036,5.933168422606047e-06,19,18,COMPLETE
296,0.3782345497975305,2026-07-12 19:36:48.730592,2026-07-12 19:36:50.129852,0 days 00:00:01.399260,3.7977460946119514e-06,entropy,11,0.5500731060844372,0.0003619597152554071,20,18,COMPLETE
297,0.40108204752090304,2026-07-12 19:36:50.130251,2026-07-12 19:36:51.829906,0 days 00:00:01.699655,0.0001051200862887376,entropy,13,0.4778765438988889,8.626462921162817e-06,20,17,COMPLETE
298,0.3986449872731,2026-07-12 19:36:51.830149,2026-07-12 19:36:53.409319,0 days 00:00:01.579170,9.481715668990691e-05,entropy,11,0.4824564105621451,1.5223700967794058e-06,19,17,COMPLETE
299,0.37951323042825724,2026-07-12 19:36:53.409610,2026-07-12 19:36:54.957855,0 days 00:00:01.548245,0.0003371038537363477,entropy,11,0.47572120170621457,3.649008516767036e-06,19,16,COMPLETE
300,0.37754402136577786,2026-07-12 19:36:54.958119,2026-07-12 19:36:56.353987,0 days 00:00:01.395868,0.00010073995084279191,entropy,10,0.48689572260663455,0.0002979894828911465,19,17,COMPLETE
301,0.36449104121853737,2026-07-12 19:36:56.354835,2026-07-12 19:36:57.596555,0 days 00:00:01.241720,0.00026427485140172966,entropy,11,0.49510276726115854,0.0006041262560280396,20,17,COMPLETE
302,0.3161939439758279,2026-07-12 19:36:57.596969,2026-07-12 19:36:58.685221,0 days 00:00:01.088252,0.00021567143433528043,entropy,10,0.48260786873320005,0.003289115308127681,20,17,COMPLETE
303,0.38219418728571763,2026-07-12 19:36:58.685512,2026-07-12 19:36:59.987235,0 days 00:00:01.301723,9.067987329554522e-05,entropy,11,0.4531076617416491,0.0002499702918287906,19,17,COMPLETE
304,0.3952468386904585,2026-07-12 19:36:59.987525,2026-07-12 19:37:01.620992,0 days 00:00:01.633467,0.00016896571186712062,entropy,11,0.5063835924279176,3.5530484516035095e-06,20,16,COMPLETE
305,0.3722492702676655,2026-07-12 19:37:01.621366,2026-07-12 19:37:02.848380,0 days 00:00:01.227014,0.0003837373289511035,entropy,12,0.4714613793297159,0.00047492148541948147,19,17,COMPLETE
306,0.39115160012028605,2026-07-12 19:37:02.848654,2026-07-12 19:37:04.368808,0 days 00:00:01.520154,8.281748209802985e-05,entropy,12,0.5276950445328745,0.00019417641808168267,20,17,COMPLETE
307,0.3119716068951298,2026-07-12 19:37:04.369100,2026-07-12 19:37:05.739243,0 days 00:00:01.370143,0.0035325568648891586,entropy,13,0.5141726911456288,0.0003421858120765927,20,18,COMPLETE
308,0.3833720874399231,2026-07-12 19:37:05.739498,2026-07-12 19:37:07.517497,0 days 00:00:01.777999,4.2127463968629085e-06,entropy,13,0.5419383751726363,2.9001778277260816e-06,19,17,COMPLETE
309,0.381419805413724,2026-07-12 19:37:07.517866,2026-07-12 19:37:09.073741,0 days 00:00:01.555875,0.00027414327881044036,entropy,12,0.46266708508916154,1.6347240925576741e-06,20,16,COMPLETE
310,0.3618506584938175,2026-07-12 19:37:09.074040,2026-07-12 19:37:10.383719,0 days 00:00:01.309679,2.709993040315184e-06,entropy,13,0.43997578527359943,0.0007672100023112111,20,18,COMPLETE
311,0.3841355746119806,2026-07-12 19:37:10.384091,2026-07-12 19:37:11.813493,0 days 00:00:01.429402,0.00016267427963834326,entropy,13,0.5559732240799152,0.00023486653825708102,19,18,COMPLETE
312,0.31243772679772863,2026-07-12 19:37:11.813939,2026-07-12 19:37:13.602392,0 days 00:00:01.788453,0.004816294107854227,entropy,13,0.9845366678976534,0.000473431699808806,20,17,COMPLETE
313,0.39135231811340165,2026-07-12 19:37:13.602726,2026-07-12 19:37:15.172542,0 days 00:00:01.569816,9.626379957213964e-05,entropy,13,0.6099951172311175,0.0002069673801414456,20,18,COMPLETE
314,0.39074658930661094,2026-07-12 19:37:15.172767,2026-07-12 19:37:16.882326,0 days 00:00:01.709559,0.0002077284238224975,entropy,12,0.49845896785312427,1.8564887860829645e-06,20,17,COMPLETE
315,0.37532295191620346,2026-07-12 19:37:16.882654,2026-07-12 19:37:18.217014,0 days 00:00:01.334360,1.5737289850429508e-06,entropy,9,0.5280487550013614,0.0004268041350735431,20,18,COMPLETE
316,0.37958066386944905,2026-07-12 19:37:18.217261,2026-07-12 19:37:19.635234,0 days 00:00:01.417973,0.00033511465447279287,entropy,13,0.5440944242981393,0.00020730902203023016,19,17,COMPLETE
317,0.37251860572105444,2026-07-12 19:37:19.635643,2026-07-12 19:37:20.952046,0 days 00:00:01.316403,0.00011396792130770687,entropy,13,0.5562061403439059,0.0005813050343640292,20,18,COMPLETE
318,0.3855622127305649,2026-07-12 19:37:20.952404,2026-07-12 19:37:22.440253,0 days 00:00:01.487849,0.000248318004434039,entropy,13,0.5708594434635781,0.0001964480630000298,20,18,COMPLETE
319,0.37622099653445945,2026-07-12 19:37:22.440539,2026-07-12 19:37:23.837164,0 days 00:00:01.396625,9.894543371237813e-05,entropy,12,0.5216795882791623,0.00037621670178679043,19,17,COMPLETE
320,0.39607060668860117,2026-07-12 19:37:23.837430,2026-07-12 19:37:25.581220,0 days 00:00:01.743790,0.00017586947168071938,entropy,11,0.5928053153639169,6.42154604002042e-06,20,18,COMPLETE
321,0.31132368338999605,2026-07-12 19:37:25.581554,2026-07-12 19:37:26.743255,0 days 00:00:01.161701,9.424027298858282e-05,entropy,13,0.5615830130994919,0.005451209562408258,19,16,COMPLETE
322,0.30600691810968855,2026-07-12 19:37:26.744197,2026-07-12 19:37:27.788172,0 days 00:00:01.043975,0.00028676264142088394,entropy,3,0.5470642872634945,0.00020615905618917671,20,18,COMPLETE
323,0.3782345497975305,2026-07-12 19:37:27.788412,2026-07-12 19:37:29.238156,0 days 00:00:01.449744,7.133276946715141e-06,entropy,13,0.5326420316227433,0.000360394494505988,19,17,COMPLETE
324,0.3965869959105266,2026-07-12 19:37:29.238407,2026-07-12 19:37:31.122747,0 days 00:00:01.884340,0.0001655765355273388,entropy,13,0.5786230010078796,4.479744471149866e-06,20,18,COMPLETE
325,0.3675721402845838,2026-07-12 19:37:31.123142,2026-07-12 19:37:32.452401,0 days 00:00:01.329259,9.03055003537727e-05,entropy,13,0.506434318694801,0.0007311697390246487,20,18,COMPLETE
326,0.3897669038995474,2026-07-12 19:37:32.452681,2026-07-12 19:37:33.931563,0 days 00:00:01.478882,0.0002238069113666891,entropy,10,0.6049923883442254,0.00018823809216345953,20,16,COMPLETE
327,0.3663866590509809,2026-07-12 19:37:33.931828,2026-07-12 19:37:35.230734,0 days 00:00:01.298906,4.5872331811529774e-07,entropy,13,0.47402024163455697,0.0004987890315515098,19,19,COMPLETE
328,0.3823428341063827,2026-07-12 19:37:35.231082,2026-07-12 19:37:36.671393,0 days 00:00:01.440311,0.0003989233569602302,entropy,13,0.5384172669401182,0.000246207831000071,20,17,COMPLETE
329,0.3893390699886547,2026-07-12 19:37:36.671788,2026-07-12 19:37:38.107854,0 days 00:00:01.436066,0.0001595159931951266,entropy,12,0.5696269049050655,0.00018399313090857218,20,18,COMPLETE
330,0.375290522298701,2026-07-12 19:37:38.108902,2026-07-12 19:37:39.445679,0 days 00:00:01.336777,9.352600908557992e-05,entropy,13,0.5180416544719163,0.0003740354748482823,20,17,COMPLETE
331,0.38209699883642745,2026-07-12 19:37:39.445984,2026-07-12 19:37:41.159841,0 days 00:00:01.713857,2.904001261575884e-07,entropy,13,0.48644088465133434,2.8884823617413802e-06,19,17,COMPLETE
332,0.36942643370706235,2026-07-12 19:37:41.160127,2026-07-12 19:37:42.531278,0 days 00:00:01.371151,0.00029796210274086814,entropy,13,0.5886373874795853,0.0006232932323168171,20,18,COMPLETE
333,0.389577791095925,2026-07-12 19:37:42.531702,2026-07-12 19:37:43.993990,0 days 00:00:01.462288,0.00020830376288359076,entropy,12,0.5560208704235187,0.00018307672042966848,20,18,COMPLETE
334,0.3808085300108033,2026-07-12 19:37:43.994253,2026-07-12 19:37:45.661903,0 days 00:00:01.667650,9.229305965800784e-05,entropy,13,0.7899917713947662,0.0004036074732241698,19,17,COMPLETE
335,0.38901013766234466,2026-07-12 19:37:45.662227,2026-07-12 19:37:47.142391,0 days 00:00:01.480164,0.00017182354448605397,entropy,13,0.5325260382255055,0.0001740099795615297,20,19,COMPLETE
336,0.39444421879210234,2026-07-12 19:37:47.142699,2026-07-12 19:37:48.706948,0 days 00:00:01.564249,2.33673468989746e-06,entropy,13,0.5765490018413943,0.00017739099142607988,19,18,COMPLETE
337,0.37182103962964375,2026-07-12 19:37:48.707228,2026-07-12 19:37:50.201673,0 days 00:00:01.494445,0.00032274685405765105,entropy,12,0.5561855251929889,0.0005147554535329561,20,19,COMPLETE
338,0.40257976849432014,2026-07-12 19:37:50.202042,2026-07-12 19:37:52.850525,0 days 00:00:02.648483,9.067544444144435e-05,entropy,13,0.920213323591131,7.326346969318315e-06,20,16,COMPLETE
339,0.3931527885789454,2026-07-12 19:37:52.850823,2026-07-12 19:37:55.318292,0 days 00:00:02.467469,0.00024245107443326432,entropy,13,0.8999257168781285,4.442173873992924e-06,19,16,COMPLETE
340,0.34177668592554716,2026-07-12 19:37:55.318577,2026-07-12 19:37:57.056222,0 days 00:00:01.737645,0.002382624964856196,entropy,13,0.9265081655446428,0.00033546849345799214,20,16,COMPLETE
341,0.3824306452230629,2026-07-12 19:37:57.056618,2026-07-12 19:37:58.686191,0 days 00:00:01.629573,0.00013372679702186065,entropy,13,0.8089152629232702,0.0003615677680924638,20,16,COMPLETE
