[2026-07-12 19:32:28] [Ensayo] Trial 122 finished with value: 0.37693715922039106 and parameters: {'criterion': 'gini', 'max_depth': 14, 'min_samples_split': 16, 'min_samples_leaf': 11, 'max_features': 0.705280174912125, 'min_impurity_decrease': 1.5201355629712664e-05, 'ccp_alpha': 0.00026465382781359854}. Best is trial 115 with value: 0.3999478269569524.
[2026-07-12 19:32:29] [Ensayo] Trial 123 finished with value: 0.3576796275444768 and parameters: {'criterion': 'gini', 'max_depth': 13, 'min_samples_split': 18, 'min_samples_leaf': 11, 'max_features': 0.62806667076301, 'min_impurity_decrease': 0.0004569245525694758, 'ccp_alpha': 0.00013825395327414378}. Best is trial 115 with value: 0.3999478269569524.
[2026-07-12 19:32:31] [Ensayo] Trial 124 finished with value: 0.3626923574417537 and parameters: {'criterion': 'gini', 'max_depth': 14, 'min_samples_split': 19, 'min_samples_leaf': 9, 'max_features': 0.6435766110551706, 'min_impurity_decrease': 0.00022193440805501552, 'ccp_alpha': 0.0004469490002160546}. Best is trial 115 with value: 0.3999478269569524.
[2026-07-12 19:32:32] [Ensayo] Trial 125 finished with value: 0.3662401724608332 and parameters: {'criterion': 'gini', 'max_depth': 15, 'min_samples_split': 20, 'min_samples_leaf': 10, 'max_features': 0.8072242771678549, 'min_impurity_decrease': 0.00040020025338688425, 'ccp_alpha': 0.0003176948165425448}. Best is trial 115 with value: 0.3999478269569524.
[2026-07-12 19:32:33] [Ensayo] Trial 126 finished with value: 0.2727721958046533 and parameters: {'criterion': 'gini', 'max_depth': 14, 'min_samples_split': 15, 'min_samples_leaf': 8, 'max_features': 0.763353514625803, 'min_impurity_decrease': 0.00510375144650788, 'ccp_alpha': 0.0002133399868763301}. Best is trial 115 with value: 0.3999478269569524.
[2026-07-12 19:32:35] [Ensayo] Trial 127 finished with value: 0.37204355909031844 and parameters: {'criterion': 'gini', 'max_depth': 13, 'min_samples_split': 17, 'min_samples_leaf': 17, 'max_features': 0.7171665107256407, 'min_impurity_decrease': 0.0001772965005625338, 'ccp_alpha': 0.00040063044483051603}. Best is trial 115 with value: 0.3999478269569524.
[2026-07-12 19:32:36] [Ensayo] Trial 128 finished with value: 0.3558417703210253 and parameters: {'criterion': 'gini', 'max_depth': 15, 'min_samples_split': 16, 'min_samples_leaf': 9, 'max_features': 0.7003898692292887, 'min_impurity_decrease': 0.0006115365527765093, 'ccp_alpha': 7.289483929349246e-05}. Best is trial 115 with value: 0.3999478269569524.
[2026-07-12 19:32:38] [Ensayo] Trial 129 finished with value: 0.37192556081885453 and parameters: {'criterion': 'entropy', 'max_depth': 14, 'min_samples_split': 19, 'min_samples_leaf': 11, 'max_features': 0.6714991501650022, 'min_impurity_decrease': 1.3464856012602895e-05, 'ccp_alpha': 0.0006485764790430158}. Best is trial 115 with value: 0.3999478269569524.
[2026-07-12 19:32:39] [Ensayo] Trial 130 finished with value: 0.3550166350243945 and parameters: {'criterion': 'entropy', 'max_depth': 15, 'min_samples_split': 15, 'min_samples_leaf': 8, 'max_features': 0.651859449521178, 'min_impurity_decrease': 0.0009599698587269395, 'ccp_alpha': 0.0003067580831632084}. Best is trial 115 with value: 0.3999478269569524.
[2026-07-12 19:32:41] [Ensayo] Trial 131 finished with value: 0.3810890626091716 and parameters: {'criterion': 'entropy', 'max_depth': 15, 'min_samples_split': 17, 'min_samples_leaf': 10, 'max_features': 0.6804382444303835, 'min_impurity_decrease': 0.0002820541966763344, 'ccp_alpha': 0.0004630928132403205}. Best is trial 115 with value: 0.3999478269569524.
[2026-07-12 19:32:43] [Ensayo] Trial 132 finished with value: 0.38133223286068996 and parameters: {'criterion': 'entropy', 'max_depth': 15, 'min_samples_split': 17, 'min_samples_leaf': 10, 'max_features': 0.6876666321772346, 'min_impurity_decrease': 4.0511259475152e-06, 'ccp_alpha': 0.00047322252646223354}. Best is trial 115 with value: 0.3999478269569524.
[2026-07-12 19:32:44] [Ensayo] Trial 133 finished with value: 0.37747223125412666 and parameters: {'criterion': 'entropy', 'max_depth': 14, 'min_samples_split': 17, 'min_samples_leaf': 9, 'max_features': 0.6862016612009424, 'min_impurity_decrease': 0.0003617819044403141, 'ccp_alpha': 0.0004828103426205502}. Best is trial 115 with value: 0.3999478269569524.
[2026-07-12 19:32:46] [Ensayo] Trial 134 finished with value: 0.39257520741439655 and parameters: {'criterion': 'entropy', 'max_depth': 15, 'min_samples_split': 18, 'min_samples_leaf': 12, 'max_features': 0.7132990408178237, 'min_impurity_decrease': 0.00023436783992369025, 'ccp_alpha': 0.00023458799396452364}. Best is trial 115 with value: 0.3999478269569524.
[2026-07-12 19:32:47] [Ensayo] Trial 135 finished with value: 0.37678278047400054 and parameters: {'criterion': 'entropy', 'max_depth': 14, 'min_samples_split': 18, 'min_samples_leaf': 12, 'max_features': 0.6586815869164364, 'min_impurity_decrease': 0.0004759215686978736, 'ccp_alpha': 0.00011862346099377402}. Best is trial 115 with value: 0.3999478269569524.
[2026-07-12 19:32:49] [Ensayo] Trial 136 finished with value: 0.389908641463424 and parameters: {'criterion': 'entropy', 'max_depth': 15, 'min_samples_split': 19, 'min_samples_leaf': 11, 'max_features': 0.6936894919282998, 'min_impurity_decrease': 0.00024145701170118818, 'ccp_alpha': 0.0002302004551916794}. Best is trial 115 with value: 0.3999478269569524.
[2026-07-12 19:32:50] [Ensayo] Trial 137 finished with value: 0.36968682898703975 and parameters: {'criterion': 'entropy', 'max_depth': 15, 'min_samples_split': 19, 'min_samples_leaf': 12, 'max_features': 0.7111536343496381, 'min_impurity_decrease': 0.0007507867270728382, 'ccp_alpha': 0.00024041349482022636}. Best is trial 115 with value: 0.3999478269569524.
[2026-07-12 19:32:52] [Ensayo] Trial 138 finished with value: 0.36902998314478624 and parameters: {'criterion': 'gini', 'max_depth': 15, 'min_samples_split': 18, 'min_samples_leaf': 13, 'max_features': 0.6945815187739182, 'min_impurity_decrease': 0.0002698197389768202, 'ccp_alpha': 8.497998586519056e-05}. Best is trial 115 with value: 0.3999478269569524.
[2026-07-12 19:32:53] [Ensayo] Trial 139 finished with value: 0.37927027533984803 and parameters: {'criterion': 'entropy', 'max_depth': 15, 'min_samples_split': 19, 'min_samples_leaf': 12, 'max_features': 0.732037287489381, 'min_impurity_decrease': 0.0005782681977413841, 'ccp_alpha': 0.0003499643921787591}. Best is trial 115 with value: 0.3999478269569524.
[2026-07-12 19:32:55] [Ensayo] Trial 140 finished with value: 0.3778615011651012 and parameters: {'criterion': 'entropy', 'max_depth': 15, 'min_samples_split': 20, 'min_samples_leaf': 14, 'max_features': 0.728806176047435, 'min_impurity_decrease': 0.0005645844502029317, 'ccp_alpha': 0.0003451612461048828}. Best is trial 115 with value: 0.3999478269569524.
[2026-07-12 19:32:56] [Ensayo] Trial 141 finished with value: 0.38563585558291924 and parameters: {'criterion': 'entropy', 'max_depth': 15, 'min_samples_split': 19, 'min_samples_leaf': 12, 'max_features': 0.6800383417919815, 'min_impurity_decrease': 0.0002948134063128008, 'ccp_alpha': 0.00021075639487551}. Best is trial 115 with value: 0.3999478269569524.
[2026-07-12 19:32:58] [Ensayo] Trial 142 finished with value: 0.3831804258994982 and parameters: {'criterion': 'entropy', 'max_depth': 15, 'min_samples_split': 19, 'min_samples_leaf': 14, 'max_features': 0.6742839468313835, 'min_impurity_decrease': 0.00030545689876542093, 'ccp_alpha': 7.034282670935948e-06}. Best is trial 115 with value: 0.3999478269569524.
[2026-07-12 19:33:00] [Ensayo] Trial 143 finished with value: 0.38619421718671304 and parameters: {'criterion': 'entropy', 'max_depth': 15, 'min_samples_split': 18, 'min_samples_leaf': 14, 'max_features': 0.6792421822540338, 'min_impurity_decrease': 0.00027059163673572885, 'ccp_alpha': 0.00018683753862501777}. Best is trial 115 with value: 0.3999478269569524.
[2026-07-12 19:33:01] [Ensayo] Trial 144 finished with value: 0.3821820513917674 and parameters: {'criterion': 'entropy', 'max_depth': 15, 'min_samples_split': 18, 'min_samples_leaf': 16, 'max_features': 0.6678627682376428, 'min_impurity_decrease': 0.00031286444599461124, 'ccp_alpha': 0.00017229742855974256}. Best is trial 115 with value: 0.3999478269569524.
[2026-07-12 19:33:03] [Ensayo] Trial 145 finished with value: 0.3823056732808861 and parameters: {'criterion': 'entropy', 'max_depth': 15, 'min_samples_split': 18, 'min_samples_leaf': 16, 'max_features': 0.6669651866406269, 'min_impurity_decrease': 0.0003188488824911297, 'ccp_alpha': 0.00018156745131396205}. Best is trial 115 with value: 0.3999478269569524.
[2026-07-12 19:33:04] [Ensayo] Trial 146 finished with value: 0.3614217269117611 and parameters: {'criterion': 'entropy', 'max_depth': 15, 'min_samples_split': 19, 'min_samples_leaf': 16, 'max_features': 0.6212749242277638, 'min_impurity_decrease': 0.001096367466762107, 'ccp_alpha': 3.076886871653149e-05}. Best is trial 115 with value: 0.3999478269569524.
[2026-07-12 19:33:05] [Ensayo] Trial 147 finished with value: 0.36078920548942356 and parameters: {'criterion': 'entropy', 'max_depth': 15, 'min_samples_split': 20, 'min_samples_leaf': 15, 'max_features': 0.6681355812210442, 'min_impurity_decrease': 0.0008917382644353526, 'ccp_alpha': 0.0001788567406496612}. Best is trial 115 with value: 0.3999478269569524.
[2026-07-12 19:33:07] [Ensayo] Trial 148 finished with value: 0.38195398847994494 and parameters: {'criterion': 'entropy', 'max_depth': 15, 'min_samples_split': 18, 'min_samples_leaf': 17, 'max_features': 0.7000444125626203, 'min_impurity_decrease': 0.0004017129622921999, 'ccp_alpha': 9.489704100354955e-07}. Best is trial 115 with value: 0.3999478269569524.
[2026-07-12 19:33:08] [Ensayo] Trial 149 finished with value: 0.36437749005469666 and parameters: {'criterion': 'entropy', 'max_depth': 15, 'min_samples_split': 18, 'min_samples_leaf': 16, 'max_features': 0.6419293854035522, 'min_impurity_decrease': 0.0007579027177647493, 'ccp_alpha': 1.656964368603798e-07}. Best is trial 115 with value: 0.3999478269569524.
[2026-07-12 19:33:10] [Ensayo] Trial 150 finished with value: 0.3726575541795377 and parameters: {'criterion': 'gini', 'max_depth': 15, 'min_samples_split': 19, 'min_samples_leaf': 17, 'max_features': 0.9357552820639476, 'min_impurity_decrease': 0.0003450695172220153, 'ccp_alpha': 0.0001735578860213878}. Best is trial 115 with value: 0.3999478269569524.
[2026-07-12 19:33:12] [Ensayo] Trial 151 finished with value: 0.37794817168598027 and parameters: {'criterion': 'entropy', 'max_depth': 15, 'min_samples_split': 18, 'min_samples_leaf': 15, 'max_features': 0.7080730227867649, 'min_impurity_decrease': 0.00042789326622946875, 'ccp_alpha': 0.00010977197696637133}. Best is trial 115 with value: 0.3999478269569524.
[2026-07-12 19:33:13] [Ensayo] Trial 152 finished with value: 0.38981492004445295 and parameters: {'criterion': 'entropy', 'max_depth': 15, 'min_samples_split': 19, 'min_samples_leaf': 18, 'max_features': 0.697945813781603, 'min_impurity_decrease': 0.0002404202111314118, 'ccp_alpha': 0.00025303246616690134}. Best is trial 115 with value: 0.3999478269569524.
[2026-07-12 19:33:14] [Ensayo] Trial 153 finished with value: 0.38495894483954574 and parameters: {'criterion': 'entropy', 'max_depth': 15, 'min_samples_split': 19, 'min_samples_leaf': 17, 'max_features': 0.6649825899802017, 'min_impurity_decrease': 0.0002864688167708948, 'ccp_alpha': 0.00022526154990065015}. Best is trial 115 with value: 0.3999478269569524.
[2026-07-12 19:33:16] [Ensayo] Trial 154 finished with value: 0.387472067104271 and parameters: {'criterion': 'entropy', 'max_depth': 15, 'min_samples_split': 20, 'min_samples_leaf': 19, 'max_features': 0.6648220219134781, 'min_impurity_decrease': 0.00026971115008314736, 'ccp_alpha': 0.00022014397915808887}. Best is trial 115 with value: 0.3999478269569524.
[2026-07-12 19:33:17] [Ensayo] Trial 155 finished with value: 0.370832458566228 and parameters: {'criterion': 'entropy', 'max_depth': 15, 'min_samples_split': 19, 'min_samples_leaf': 18, 'max_features': 0.6637999663026769, 'min_impurity_decrease': 0.0006514592593589207, 'ccp_alpha': 6.193472676524797e-06}. Best is trial 115 with value: 0.3999478269569524.
[2026-07-12 19:33:19] [Ensayo] Trial 156 finished with value: 0.3922947226942956 and parameters: {'criterion': 'entropy', 'max_depth': 15, 'min_samples_split': 20, 'min_samples_leaf': 19, 'max_features': 0.7169212655591604, 'min_impurity_decrease': 0.000234224829936036, 'ccp_alpha': 0.00022397675535168373}. Best is trial 115 with value: 0.3999478269569524.
[2026-07-12 19:33:20] [Ensayo] Trial 157 finished with value: 0.3662693150550396 and parameters: {'criterion': 'entropy', 'max_depth': 15, 'min_samples_split': 20, 'min_samples_leaf': 20, 'max_features': 0.7160729902314796, 'min_impurity_decrease': 0.000931471609198199, 'ccp_alpha': 0.00011579696383363708}. Best is trial 115 with value: 0.3999478269569524.
[2026-07-12 19:33:22] [Ensayo] Trial 158 finished with value: 0.3823056732808861 and parameters: {'criterion': 'entropy', 'max_depth': 15, 'min_samples_split': 20, 'min_samples_leaf': 19, 'max_features': 0.6682251839034767, 'min_impurity_decrease': 0.0003181250199491297, 'ccp_alpha': 0.0002483931152225047}. Best is trial 115 with value: 0.3999478269569524.
[2026-07-12 19:33:24] [Ensayo] Trial 159 finished with value: 0.38831771153392797 and parameters: {'criterion': 'entropy', 'max_depth': 15, 'min_samples_split': 20, 'min_samples_leaf': 19, 'max_features': 0.6392332586399152, 'min_impurity_decrease': 0.0002620141891089044, 'ccp_alpha': 0.0002568022334582617}. Best is trial 115 with value: 0.3999478269569524.
[2026-07-12 19:33:25] [Ensayo] Trial 160 finished with value: 0.37087629156255325 and parameters: {'criterion': 'entropy', 'max_depth': 15, 'min_samples_split': 20, 'min_samples_leaf': 19, 'max_features': 0.6299936657014777, 'min_impurity_decrease': 0.0005551655940596197, 'ccp_alpha': 0.00026979126279193694}. Best is trial 115 with value: 0.3999478269569524.
[2026-07-12 19:33:27] [Ensayo] Trial 161 finished with value: 0.3887721403177814 and parameters: {'criterion': 'entropy', 'max_depth': 15, 'min_samples_split': 20, 'min_samples_leaf': 18, 'max_features': 0.6461699685676796, 'min_impurity_decrease': 0.00027035258817857894, 'ccp_alpha': 0.00021582981534817476}. Best is trial 115 with value: 0.3999478269569524.
[2026-07-12 19:33:28] [Ensayo] Trial 162 finished with value: 0.3868675750448682 and parameters: {'criterion': 'entropy', 'max_depth': 15, 'min_samples_split': 20, 'min_samples_leaf': 18, 'max_features': 0.6526214010632835, 'min_impurity_decrease': 0.0002611036041871222, 'ccp_alpha': 0.00028389472862122724}. Best is trial 115 with value: 0.3999478269569524.
[2026-07-12 19:33:30] [Ensayo] Trial 163 finished with value: 0.38737692633475407 and parameters: {'criterion': 'entropy', 'max_depth': 15, 'min_samples_split': 20, 'min_samples_leaf': 18, 'max_features': 0.6553117599580279, 'min_impurity_decrease': 0.0002292328643217527, 'ccp_alpha': 0.0003058216534100671}. Best is trial 115 with value: 0.3999478269569524.
[2026-07-12 19:33:31] [Ensayo] Trial 164 finished with value: 0.3671193250356203 and parameters: {'criterion': 'entropy', 'max_depth': 15, 'min_samples_split': 20, 'min_samples_leaf': 18, 'max_features': 0.6483975094635901, 'min_impurity_decrease': 0.0007074633622360007, 'ccp_alpha': 0.00031750020872175014}. Best is trial 115 with value: 0.3999478269569524.
[2026-07-12 19:33:33] [Ensayo] Trial 165 finished with value: 0.38658166974198427 and parameters: {'criterion': 'entropy', 'max_depth': 15, 'min_samples_split': 20, 'min_samples_leaf': 18, 'max_features': 0.6148364351801782, 'min_impurity_decrease': 0.00022532746643082023, 'ccp_alpha': 9.181405074602442e-05}. Best is trial 115 with value: 0.3999478269569524.
[2026-07-12 19:33:34] [Ensayo] Trial 166 finished with value: 0.3709743921324629 and parameters: {'criterion': 'entropy', 'max_depth': 15, 'min_samples_split': 20, 'min_samples_leaf': 18, 'max_features': 0.6356346895024865, 'min_impurity_decrease': 0.0005477181968437226, 'ccp_alpha': 0.0002739858777253845}. Best is trial 115 with value: 0.3999478269569524.
[2026-07-12 19:33:36] [Ensayo] Trial 167 finished with value: 0.39014769916751474 and parameters: {'criterion': 'entropy', 'max_depth': 15, 'min_samples_split': 20, 'min_samples_leaf': 19, 'max_features': 0.6216173348324452, 'min_impurity_decrease': 0.00022892312163713322, 'ccp_alpha': 0.00011043682615349613}. Best is trial 115 with value: 0.3999478269569524.
[2026-07-12 19:33:37] [Ensayo] Trial 168 finished with value: 0.36697724424881006 and parameters: {'criterion': 'entropy', 'max_depth': 15, 'min_samples_split': 20, 'min_samples_leaf': 19, 'max_features': 0.6403834288214868, 'min_impurity_decrease': 0.0008262540477579961, 'ccp_alpha': 0.00011508568185567983}. Best is trial 115 with value: 0.3999478269569524.
[2026-07-12 19:33:39] [Ensayo] Trial 169 finished with value: 0.3866655042940592 and parameters: {'criterion': 'entropy', 'max_depth': 15, 'min_samples_split': 20, 'min_samples_leaf': 18, 'max_features': 0.6215520051819032, 'min_impurity_decrease': 0.0002118403435386176, 'ccp_alpha': 0.0003491752880903226}. Best is trial 115 with value: 0.3999478269569524.
[2026-07-12 19:33:40] [Ensayo] Trial 170 finished with value: 0.38497815454968753 and parameters: {'criterion': 'entropy', 'max_depth': 15, 'min_samples_split': 20, 'min_samples_leaf': 18, 'max_features': 0.6052740478257439, 'min_impurity_decrease': 0.00022200418750453185, 'ccp_alpha': 0.00034789060382035955}. Best is trial 115 with value: 0.3999478269569524.
[2026-07-12 19:33:42] [Ensayo] Trial 171 finished with value: 0.3844385287892122 and parameters: {'criterion': 'entropy', 'max_depth': 15, 'min_samples_split': 20, 'min_samples_leaf': 18, 'max_features': 0.6156639636178682, 'min_impurity_decrease': 0.00021951121680450835, 'ccp_alpha': 0.00036746252589193106}. Best is trial 115 with value: 0.3999478269569524.
[2026-07-12 19:33:43] [Ensayo] Trial 172 finished with value: 0.3744121625977028 and parameters: {'criterion': 'entropy', 'max_depth': 15, 'min_samples_split': 20, 'min_samples_leaf': 20, 'max_features': 0.6084339776893921, 'min_impurity_decrease': 0.0005503621155895592, 'ccp_alpha': 0.0003107355491648704}. Best is trial 115 with value: 0.3999478269569524.
[2026-07-12 19:33:45] [Ensayo] Trial 173 finished with value: 0.3766084187513412 and parameters: {'criterion': 'entropy', 'max_depth': 15, 'min_samples_split': 20, 'min_samples_leaf': 18, 'max_features': 0.6213809220953909, 'min_impurity_decrease': 0.00046403972379464495, 'ccp_alpha': 0.0001173680356749523}. Best is trial 115 with value: 0.3999478269569524.
[2026-07-12 19:33:46] [Ensayo] Trial 174 finished with value: 0.38420329024937017 and parameters: {'criterion': 'entropy', 'max_depth': 15, 'min_samples_split': 19, 'min_samples_leaf': 19, 'max_features': 0.6308755048065879, 'min_impurity_decrease': 0.0002692703535171892, 'ccp_alpha': 0.00035740580555859377}. Best is trial 115 with value: 0.3999478269569524.
[2026-07-12 19:33:48] [Ensayo] Trial 175 finished with value: 0.36756529697144935 and parameters: {'criterion': 'entropy', 'max_depth': 15, 'min_samples_split': 20, 'min_samples_leaf': 19, 'max_features': 0.6525472867831172, 'min_impurity_decrease': 0.0007109066462248094, 'ccp_alpha': 0.00022768262995349046}. Best is trial 115 with value: 0.3999478269569524.
[2026-07-12 19:33:49] [Ensayo] Trial 176 finished with value: 0.39194373652393544 and parameters: {'criterion': 'entropy', 'max_depth': 15, 'min_samples_split': 19, 'min_samples_leaf': 18, 'max_features': 0.5806954249046128, 'min_impurity_decrease': 0.0001852340455669714, 'ccp_alpha': 9.511188037021273e-05}. Best is trial 115 with value: 0.3999478269569524.
[2026-07-12 19:33:51] [Ensayo] Trial 177 finished with value: 0.39328715702054895 and parameters: {'criterion': 'entropy', 'max_depth': 14, 'min_samples_split': 19, 'min_samples_leaf': 19, 'max_features': 0.5818729695249558, 'min_impurity_decrease': 0.00017072482287583022, 'ccp_alpha': 8.078395891668327e-05}. Best is trial 115 with value: 0.3999478269569524.
[2026-07-12 19:33:52] [Ensayo] Trial 178 finished with value: 0.3939515960488873 and parameters: {'criterion': 'entropy', 'max_depth': 14, 'min_samples_split': 19, 'min_samples_leaf': 20, 'max_features': 0.6147149538292142, 'min_impurity_decrease': 0.00015894395489644332, 'ccp_alpha': 9.51462739178655e-05}. Best is trial 115 with value: 0.3999478269569524.
[2026-07-12 19:33:53] [Ensayo] Trial 179 finished with value: 0.37576791419046807 and parameters: {'criterion': 'entropy', 'max_depth': 14, 'min_samples_split': 19, 'min_samples_leaf': 19, 'max_features': 0.5751266705649163, 'min_impurity_decrease': 0.0004993058913438144, 'ccp_alpha': 7.565856058204507e-05}. Best is trial 115 with value: 0.3999478269569524.
[2026-07-12 19:33:55] [Ensayo] Trial 180 finished with value: 0.3932535862120166 and parameters: {'criterion': 'entropy', 'max_depth': 14, 'min_samples_split': 19, 'min_samples_leaf': 20, 'max_features': 0.6236749423651227, 'min_impurity_decrease': 0.00018152826418412166, 'ccp_alpha': 8.895333956698343e-05}. Best is trial 115 with value: 0.3999478269569524.
[2026-07-12 19:33:56] [Ensayo] Trial 181 finished with value: 0.3919219882681496 and parameters: {'criterion': 'entropy', 'max_depth': 14, 'min_samples_split': 19, 'min_samples_leaf': 18, 'max_features': 0.5905261479480958, 'min_impurity_decrease': 0.00018255685663153505, 'ccp_alpha': 0.00011002193496619296}. Best is trial 115 with value: 0.3999478269569524.
[2026-07-12 19:33:57] [Ensayo] Trial 182 finished with value: 0.3877754275426652 and parameters: {'criterion': 'entropy', 'max_depth': 14, 'min_samples_split': 19, 'min_samples_leaf': 20, 'max_features': 0.5947575388275415, 'min_impurity_decrease': 0.00019922914037219866, 'ccp_alpha': 8.851244327189771e-05}. Best is trial 115 with value: 0.3999478269569524.
