[2026-07-12 19:33:59] [Ensayo] Trial 183 finished with value: 0.3760582432998932 and parameters: {'criterion': 'entropy', 'max_depth': 14, 'min_samples_split': 19, 'min_samples_leaf': 20, 'max_features': 0.5883906803832377, 'min_impurity_decrease': 0.00044518418112973767, 'ccp_alpha': 9.920507006597727e-05}. Best is trial 115 with value: 0.3999478269569524.
[2026-07-12 19:34:00] [Ensayo] Trial 184 finished with value: 0.3941869803930925 and parameters: {'criterion': 'entropy', 'max_depth': 14, 'min_samples_split': 19, 'min_samples_leaf': 20, 'max_features': 0.579251399738982, 'min_impurity_decrease': 0.0001757675821800056, 'ccp_alpha': 0.0001133757688694056}. Best is trial 115 with value: 0.3999478269569524.
[2026-07-12 19:34:01] [Ensayo] Trial 185 finished with value: 0.3919219882681496 and parameters: {'criterion': 'entropy', 'max_depth': 14, 'min_samples_split': 19, 'min_samples_leaf': 20, 'max_features': 0.5774423852686371, 'min_impurity_decrease': 0.0001820916466713106, 'ccp_alpha': 6.238544509977462e-09}. Best is trial 115 with value: 0.3999478269569524.
[2026-07-12 19:34:03] [Ensayo] Trial 186 finished with value: 0.37042403056627354 and parameters: {'criterion': 'entropy', 'max_depth': 14, 'min_samples_split': 19, 'min_samples_leaf': 20, 'max_features': 0.5653114308453917, 'min_impurity_decrease': 0.0005933817366601598, 'ccp_alpha': 7.167313152733326e-06}. Best is trial 115 with value: 0.3999478269569524.
[2026-07-12 19:34:04] [Ensayo] Trial 187 finished with value: 0.3958211083380953 and parameters: {'criterion': 'entropy', 'max_depth': 14, 'min_samples_split': 19, 'min_samples_leaf': 20, 'max_features': 0.5885954112151348, 'min_impurity_decrease': 0.0001669546763294223, 'ccp_alpha': 0.00012233297197598118}. Best is trial 115 with value: 0.3999478269569524.
[2026-07-12 19:34:06] [Ensayo] Trial 188 finished with value: 0.3952799615660309 and parameters: {'criterion': 'entropy', 'max_depth': 14, 'min_samples_split': 19, 'min_samples_leaf': 20, 'max_features': 0.5840724117203714, 'min_impurity_decrease': 0.00013628139263648274, 'ccp_alpha': 9.306770267136698e-05}. Best is trial 115 with value: 0.3999478269569524.
[2026-07-12 19:34:07] [Ensayo] Trial 189 finished with value: 0.37575589565039336 and parameters: {'criterion': 'entropy', 'max_depth': 14, 'min_samples_split': 19, 'min_samples_leaf': 20, 'max_features': 0.5726840857031082, 'min_impurity_decrease': 0.0004861117984979994, 'ccp_alpha': 0.00011654387351932192}. Best is trial 115 with value: 0.3999478269569524.
[2026-07-12 19:34:09] [Ensayo] Trial 190 finished with value: 0.39693343507789075 and parameters: {'criterion': 'entropy', 'max_depth': 14, 'min_samples_split': 19, 'min_samples_leaf': 20, 'max_features': 0.5811212417066891, 'min_impurity_decrease': 0.0001349368421558698, 'ccp_alpha': 8.055554280625484e-05}. Best is trial 115 with value: 0.3999478269569524.
[2026-07-12 19:34:10] [Ensayo] Trial 191 finished with value: 0.3961111681579102 and parameters: {'criterion': 'entropy', 'max_depth': 14, 'min_samples_split': 19, 'min_samples_leaf': 20, 'max_features': 0.5811298360776309, 'min_impurity_decrease': 0.00014216150554852654, 'ccp_alpha': 1.0590790986649774e-05}. Best is trial 115 with value: 0.3999478269569524.
[2026-07-12 19:34:12] [Ensayo] Trial 192 finished with value: 0.3806337017658709 and parameters: {'criterion': 'entropy', 'max_depth': 14, 'min_samples_split': 19, 'min_samples_leaf': 20, 'max_features': 0.5866645412213787, 'min_impurity_decrease': 3.98111381884217e-06, 'ccp_alpha': 2.904764000736615e-06}. Best is trial 115 with value: 0.3999478269569524.
[2026-07-12 19:34:13] [Ensayo] Trial 193 finished with value: 0.3952840933641927 and parameters: {'criterion': 'entropy', 'max_depth': 14, 'min_samples_split': 19, 'min_samples_leaf': 19, 'max_features': 0.5800854289004157, 'min_impurity_decrease': 0.00014475004061105187, 'ccp_alpha': 1.4762163147568079e-06}. Best is trial 115 with value: 0.3999478269569524.
[2026-07-12 19:34:14] [Ensayo] Trial 194 finished with value: 0.39720234021363277 and parameters: {'criterion': 'entropy', 'max_depth': 13, 'min_samples_split': 19, 'min_samples_leaf': 20, 'max_features': 0.5805986986554332, 'min_impurity_decrease': 0.00014099379238859838, 'ccp_alpha': 1.7958105760461634e-06}. Best is trial 115 with value: 0.3999478269569524.
[2026-07-12 19:34:15] [Ensayo] Trial 195 finished with value: 0.3097410264818982 and parameters: {'criterion': 'entropy', 'max_depth': 13, 'min_samples_split': 19, 'min_samples_leaf': 20, 'max_features': 0.5799516252759299, 'min_impurity_decrease': 0.004104848802016034, 'ccp_alpha': 6.349265359288311e-06}. Best is trial 115 with value: 0.3999478269569524.
[2026-07-12 19:34:17] [Ensayo] Trial 196 finished with value: 0.39771125463954726 and parameters: {'criterion': 'entropy', 'max_depth': 13, 'min_samples_split': 19, 'min_samples_leaf': 20, 'max_features': 0.5577859637260115, 'min_impurity_decrease': 0.0001337627866943211, 'ccp_alpha': 9.853081697089647e-05}. Best is trial 115 with value: 0.3999478269569524.
[2026-07-12 19:34:18] [Ensayo] Trial 197 finished with value: 0.36687419980164615 and parameters: {'criterion': 'entropy', 'max_depth': 13, 'min_samples_split': 19, 'min_samples_leaf': 20, 'max_features': 0.5618270849081407, 'min_impurity_decrease': 0.0004971510780983877, 'ccp_alpha': 9.469452119714103e-05}. Best is trial 115 with value: 0.3999478269569524.
[2026-07-12 19:34:19] [Ensayo] Trial 198 finished with value: 0.4000520998503183 and parameters: {'criterion': 'entropy', 'max_depth': 13, 'min_samples_split': 18, 'min_samples_leaf': 20, 'max_features': 0.5785829105241868, 'min_impurity_decrease': 3.409099315918344e-06, 'ccp_alpha': 9.63697929473078e-05}. Best is trial 198 with value: 0.4000520998503183.
[2026-07-12 19:34:21] [Ensayo] Trial 199 finished with value: 0.3987812238972584 and parameters: {'criterion': 'entropy', 'max_depth': 13, 'min_samples_split': 18, 'min_samples_leaf': 20, 'max_features': 0.5774148398384661, 'min_impurity_decrease': 0.00012444114666618954, 'ccp_alpha': 5.428826001586243e-06}. Best is trial 198 with value: 0.4000520998503183.
[2026-07-12 19:34:22] [Ensayo] Trial 200 finished with value: 0.4033658221541615 and parameters: {'criterion': 'entropy', 'max_depth': 13, 'min_samples_split': 18, 'min_samples_leaf': 20, 'max_features': 0.5700521845672086, 'min_impurity_decrease': 4.642748227658293e-05, 'ccp_alpha': 2.304981219574465e-05}. Best is trial 200 with value: 0.4033658221541615.
[2026-07-12 19:34:24] [Ensayo] Trial 201 finished with value: 0.40040960713119056 and parameters: {'criterion': 'entropy', 'max_depth': 13, 'min_samples_split': 18, 'min_samples_leaf': 20, 'max_features': 0.5781058337642518, 'min_impurity_decrease': 3.3844874309085196e-05, 'ccp_alpha': 1.4397161437685044e-05}. Best is trial 200 with value: 0.4033658221541615.
[2026-07-12 19:34:25] [Ensayo] Trial 202 finished with value: 0.39915240159503396 and parameters: {'criterion': 'entropy', 'max_depth': 13, 'min_samples_split': 18, 'min_samples_leaf': 20, 'max_features': 0.5561592837034733, 'min_impurity_decrease': 9.251643364652345e-05, 'ccp_alpha': 9.26014099169703e-05}. Best is trial 200 with value: 0.4033658221541615.
[2026-07-12 19:34:26] [Ensayo] Trial 203 finished with value: 0.38669353896295655 and parameters: {'criterion': 'entropy', 'max_depth': 13, 'min_samples_split': 18, 'min_samples_leaf': 20, 'max_features': 0.5539215213989889, 'min_impurity_decrease': 8.69062485326627e-06, 'ccp_alpha': 6.802141334925012e-06}. Best is trial 200 with value: 0.4033658221541615.
[2026-07-12 19:34:28] [Ensayo] Trial 204 finished with value: 0.3970431472813216 and parameters: {'criterion': 'entropy', 'max_depth': 13, 'min_samples_split': 18, 'min_samples_leaf': 20, 'max_features': 0.5695364748531795, 'min_impurity_decrease': 6.560026456706507e-05, 'ccp_alpha': 0.00014611555289065472}. Best is trial 200 with value: 0.4033658221541615.
[2026-07-12 19:34:29] [Ensayo] Trial 205 finished with value: 0.3695281541752482 and parameters: {'criterion': 'entropy', 'max_depth': 13, 'min_samples_split': 18, 'min_samples_leaf': 20, 'max_features': 0.5450918132630307, 'min_impurity_decrease': 0.00045037297829040587, 'ccp_alpha': 0.0001581083336417281}. Best is trial 200 with value: 0.4033658221541615.
[2026-07-12 19:34:31] [Ensayo] Trial 206 finished with value: 0.39362621110641527 and parameters: {'criterion': 'entropy', 'max_depth': 13, 'min_samples_split': 18, 'min_samples_leaf': 20, 'max_features': 0.5669515385220631, 'min_impurity_decrease': 3.0309820961760843e-05, 'ccp_alpha': 0.00016165881901591527}. Best is trial 200 with value: 0.4033658221541615.
[2026-07-12 19:34:33] [Ensayo] Trial 207 finished with value: 0.39431570609337674 and parameters: {'criterion': 'entropy', 'max_depth': 13, 'min_samples_split': 18, 'min_samples_leaf': 20, 'max_features': 0.5347780401820721, 'min_impurity_decrease': 2.079874969448008e-05, 'ccp_alpha': 6.457835210345691e-06}. Best is trial 200 with value: 0.4033658221541615.
[2026-07-12 19:34:34] [Ensayo] Trial 208 finished with value: 0.4014733479985414 and parameters: {'criterion': 'entropy', 'max_depth': 13, 'min_samples_split': 18, 'min_samples_leaf': 20, 'max_features': 0.5303844852958252, 'min_impurity_decrease': 4.754130784234481e-05, 'ccp_alpha': 2.6949353244979046e-06}. Best is trial 200 with value: 0.4033658221541615.
[2026-07-12 19:34:36] [Ensayo] Trial 209 finished with value: 0.40086209426282543 and parameters: {'criterion': 'entropy', 'max_depth': 13, 'min_samples_split': 18, 'min_samples_leaf': 20, 'max_features': 0.5340965581740895, 'min_impurity_decrease': 8.415593475599698e-06, 'ccp_alpha': 6.627536158561349e-05}. Best is trial 200 with value: 0.4033658221541615.
[2026-07-12 19:34:38] [Ensayo] Trial 210 finished with value: 0.3904529646415707 and parameters: {'criterion': 'entropy', 'max_depth': 13, 'min_samples_split': 18, 'min_samples_leaf': 20, 'max_features': 0.5283422592544775, 'min_impurity_decrease': 2.607567766818624e-07, 'ccp_alpha': 2.050883580266074e-05}. Best is trial 200 with value: 0.4033658221541615.
[2026-07-12 19:34:40] [Ensayo] Trial 211 finished with value: 0.40216045241818266 and parameters: {'criterion': 'entropy', 'max_depth': 13, 'min_samples_split': 18, 'min_samples_leaf': 20, 'max_features': 0.5405129421287849, 'min_impurity_decrease': 4.675435469903173e-05, 'ccp_alpha': 9.505832802715852e-06}. Best is trial 200 with value: 0.4033658221541615.
[2026-07-12 19:34:42] [Ensayo] Trial 212 finished with value: 0.4000202968602535 and parameters: {'criterion': 'entropy', 'max_depth': 13, 'min_samples_split': 17, 'min_samples_leaf': 20, 'max_features': 0.5584030899531272, 'min_impurity_decrease': 9.332680985115527e-05, 'ccp_alpha': 8.973008796285596e-08}. Best is trial 200 with value: 0.4033658221541615.
[2026-07-12 19:34:43] [Ensayo] Trial 213 finished with value: 0.39877905830076615 and parameters: {'criterion': 'entropy', 'max_depth': 13, 'min_samples_split': 17, 'min_samples_leaf': 20, 'max_features': 0.515401521156713, 'min_impurity_decrease': 8.12354025769832e-05, 'ccp_alpha': 2.996830774103541e-05}. Best is trial 200 with value: 0.4033658221541615.
[2026-07-12 19:34:45] [Ensayo] Trial 214 finished with value: 0.37390745860184105 and parameters: {'criterion': 'entropy', 'max_depth': 13, 'min_samples_split': 17, 'min_samples_leaf': 20, 'max_features': 0.5391525835634406, 'min_impurity_decrease': 0.0004696041708757646, 'ccp_alpha': 2.281480292085581e-06}. Best is trial 200 with value: 0.4033658221541615.
[2026-07-12 19:34:46] [Ensayo] Trial 215 finished with value: 0.3885924741717671 and parameters: {'criterion': 'entropy', 'max_depth': 13, 'min_samples_split': 18, 'min_samples_leaf': 20, 'max_features': 0.5118140578413751, 'min_impurity_decrease': 6.452660974888726e-06, 'ccp_alpha': 1.2286847052279032e-06}. Best is trial 200 with value: 0.4033658221541615.
[2026-07-12 19:34:48] [Ensayo] Trial 216 finished with value: 0.3759058336995753 and parameters: {'criterion': 'entropy', 'max_depth': 13, 'min_samples_split': 17, 'min_samples_leaf': 20, 'max_features': 0.5310125791529686, 'min_impurity_decrease': 0.000428290659647851, 'ccp_alpha': 0.0001312225457037241}. Best is trial 200 with value: 0.4033658221541615.
[2026-07-12 19:34:49] [Ensayo] Trial 217 finished with value: 0.40110849867676085 and parameters: {'criterion': 'entropy', 'max_depth': 13, 'min_samples_split': 18, 'min_samples_leaf': 20, 'max_features': 0.5523682230595488, 'min_impurity_decrease': 5.813017338779256e-05, 'ccp_alpha': 5.332426350853072e-07}. Best is trial 200 with value: 0.4033658221541615.
[2026-07-12 19:34:51] [Ensayo] Trial 218 finished with value: 0.31420877162502947 and parameters: {'criterion': 'entropy', 'max_depth': 13, 'min_samples_split': 18, 'min_samples_leaf': 19, 'max_features': 0.5509239253126456, 'min_impurity_decrease': 1.2582020527394098e-05, 'ccp_alpha': 0.004272709221851006}. Best is trial 200 with value: 0.4033658221541615.
[2026-07-12 19:34:53] [Ensayo] Trial 219 finished with value: 0.39762904831185564 and parameters: {'criterion': 'entropy', 'max_depth': 13, 'min_samples_split': 17, 'min_samples_leaf': 20, 'max_features': 0.5162765393400611, 'min_impurity_decrease': 2.3303808694363228e-05, 'ccp_alpha': 1.0103705930664422e-05}. Best is trial 200 with value: 0.4033658221541615.
[2026-07-12 19:34:54] [Ensayo] Trial 220 finished with value: 0.3751400211851251 and parameters: {'criterion': 'entropy', 'max_depth': 13, 'min_samples_split': 17, 'min_samples_leaf': 20, 'max_features': 0.5166626201668535, 'min_impurity_decrease': 0.0004090224796432871, 'ccp_alpha': 0.00015713734317746806}. Best is trial 200 with value: 0.4033658221541615.
[2026-07-12 19:34:55] [Ensayo] Trial 221 finished with value: 0.3978111752196415 and parameters: {'criterion': 'entropy', 'max_depth': 13, 'min_samples_split': 18, 'min_samples_leaf': 20, 'max_features': 0.5392356267298277, 'min_impurity_decrease': 2.4176793011626696e-05, 'ccp_alpha': 5.962444808339868e-07}. Best is trial 200 with value: 0.4033658221541615.
[2026-07-12 19:34:57] [Ensayo] Trial 222 finished with value: 0.3930729785096345 and parameters: {'criterion': 'entropy', 'max_depth': 13, 'min_samples_split': 18, 'min_samples_leaf': 20, 'max_features': 0.5559617720519107, 'min_impurity_decrease': 1.8007128844902215e-05, 'ccp_alpha': 5.841809492650462e-06}. Best is trial 200 with value: 0.4033658221541615.
[2026-07-12 19:34:59] [Ensayo] Trial 223 finished with value: 0.394109682389986 and parameters: {'criterion': 'entropy', 'max_depth': 13, 'min_samples_split': 17, 'min_samples_leaf': 19, 'max_features': 0.543400524021422, 'min_impurity_decrease': 2.7141288318103336e-05, 'ccp_alpha': 0.00017296900388798483}. Best is trial 200 with value: 0.4033658221541615.
[2026-07-12 19:35:00] [Ensayo] Trial 224 finished with value: 0.37048801620607097 and parameters: {'criterion': 'entropy', 'max_depth': 13, 'min_samples_split': 17, 'min_samples_leaf': 20, 'max_features': 0.5633800643018484, 'min_impurity_decrease': 0.00044200460706019526, 'ccp_alpha': 2.2530969442159676e-06}. Best is trial 200 with value: 0.4033658221541615.
[2026-07-12 19:35:02] [Ensayo] Trial 225 finished with value: 0.39944835691876823 and parameters: {'criterion': 'entropy', 'max_depth': 13, 'min_samples_split': 18, 'min_samples_leaf': 20, 'max_features': 0.5577913677355634, 'min_impurity_decrease': 3.666214898331052e-06, 'ccp_alpha': 0.00010295276471141488}. Best is trial 200 with value: 0.4033658221541615.
[2026-07-12 19:35:03] [Ensayo] Trial 226 finished with value: 0.3769724525802402 and parameters: {'criterion': 'entropy', 'max_depth': 13, 'min_samples_split': 18, 'min_samples_leaf': 20, 'max_features': 0.5558357582365331, 'min_impurity_decrease': 0.0003772352790172838, 'ccp_alpha': 9.288553193881639e-05}. Best is trial 200 with value: 0.4033658221541615.
[2026-07-12 19:35:05] [Ensayo] Trial 227 finished with value: 0.3925918095142452 and parameters: {'criterion': 'entropy', 'max_depth': 13, 'min_samples_split': 18, 'min_samples_leaf': 19, 'max_features': 0.567535208268667, 'min_impurity_decrease': 0.00016135568802145718, 'ccp_alpha': 0.00017097258976836417}. Best is trial 200 with value: 0.4033658221541615.
[2026-07-12 19:35:06] [Ensayo] Trial 228 finished with value: 0.377997473974283 and parameters: {'criterion': 'entropy', 'max_depth': 13, 'min_samples_split': 17, 'min_samples_leaf': 20, 'max_features': 0.5243825978462106, 'min_impurity_decrease': 0.0003980547598725915, 'ccp_alpha': 7.846151380986367e-05}. Best is trial 200 with value: 0.4033658221541615.
[2026-07-12 19:35:07] [Ensayo] Trial 229 finished with value: 0.3969278238906952 and parameters: {'criterion': 'entropy', 'max_depth': 12, 'min_samples_split': 18, 'min_samples_leaf': 19, 'max_features': 0.5381579661813832, 'min_impurity_decrease': 2.597678138889189e-05, 'ccp_alpha': 1.470557700929679e-07}. Best is trial 200 with value: 0.4033658221541615.
[2026-07-12 19:35:09] [Ensayo] Trial 230 finished with value: 0.3916713766864886 and parameters: {'criterion': 'entropy', 'max_depth': 12, 'min_samples_split': 18, 'min_samples_leaf': 19, 'max_features': 0.5426463250505393, 'min_impurity_decrease': 2.839650504366635e-06, 'ccp_alpha': 3.4012744120284483e-06}. Best is trial 200 with value: 0.4033658221541615.
[2026-07-12 19:35:11] [Ensayo] Trial 231 finished with value: 0.3928763806866595 and parameters: {'criterion': 'entropy', 'max_depth': 12, 'min_samples_split': 18, 'min_samples_leaf': 20, 'max_features': 0.5355868065476658, 'min_impurity_decrease': 0.00015418186524635436, 'ccp_alpha': 9.37582952370969e-05}. Best is trial 200 with value: 0.4033658221541615.
[2026-07-12 19:35:12] [Ensayo] Trial 232 finished with value: 0.3939919738159605 and parameters: {'criterion': 'entropy', 'max_depth': 13, 'min_samples_split': 18, 'min_samples_leaf': 20, 'max_features': 0.5546960131295621, 'min_impurity_decrease': 2.3960550210920832e-05, 'ccp_alpha': 0.00017717228504000388}. Best is trial 200 with value: 0.4033658221541615.
[2026-07-12 19:35:14] [Ensayo] Trial 233 finished with value: 0.3826677898874475 and parameters: {'criterion': 'entropy', 'max_depth': 13, 'min_samples_split': 17, 'min_samples_leaf': 19, 'max_features': 0.5716805122279558, 'min_impurity_decrease': 0.00037512038144972657, 'ccp_alpha': 2.25244401321042e-07}. Best is trial 200 with value: 0.4033658221541615.
[2026-07-12 19:35:15] [Ensayo] Trial 234 finished with value: 0.304693081642573 and parameters: {'criterion': 'entropy', 'max_depth': 13, 'min_samples_split': 18, 'min_samples_leaf': 20, 'max_features': 0.5197847650779278, 'min_impurity_decrease': 0.009016776507451646, 'ccp_alpha': 0.00015104276944122064}. Best is trial 200 with value: 0.4033658221541615.
[2026-07-12 19:35:16] [Ensayo] Trial 235 finished with value: 0.39330741601866565 and parameters: {'criterion': 'entropy', 'max_depth': 12, 'min_samples_split': 17, 'min_samples_leaf': 20, 'max_features': 0.5465213710058571, 'min_impurity_decrease': 0.00016577814492939606, 'ccp_alpha': 8.528736807476871e-05}. Best is trial 200 with value: 0.4033658221541615.
[2026-07-12 19:35:17] [Ensayo] Trial 236 finished with value: 0.3890678381022698 and parameters: {'criterion': 'entropy', 'max_depth': 13, 'min_samples_split': 18, 'min_samples_leaf': 19, 'max_features': 0.562218051143491, 'min_impurity_decrease': 0.0001758247112742689, 'ccp_alpha': 0.000172593599408751}. Best is trial 200 with value: 0.4033658221541615.
[2026-07-12 19:35:19] [Ensayo] Trial 237 finished with value: 0.3859059534582618 and parameters: {'criterion': 'entropy', 'max_depth': 13, 'min_samples_split': 17, 'min_samples_leaf': 20, 'max_features': 0.5063553148152614, 'min_impurity_decrease': 6.160517924699922e-06, 'ccp_alpha': 2.531016800042321e-06}. Best is trial 200 with value: 0.4033658221541615.
[2026-07-12 19:35:20] [Ensayo] Trial 238 finished with value: 0.37588992797533205 and parameters: {'criterion': 'entropy', 'max_depth': 13, 'min_samples_split': 18, 'min_samples_leaf': 20, 'max_features': 0.532617301093906, 'min_impurity_decrease': 0.0003695815758604475, 'ccp_alpha': 0.00021172996063307457}. Best is trial 200 with value: 0.4033658221541615.
[2026-07-12 19:35:22] [Ensayo] Trial 239 finished with value: 0.37210092560898256 and parameters: {'criterion': 'entropy', 'max_depth': 12, 'min_samples_split': 18, 'min_samples_leaf': 19, 'max_features': 0.5701085097195692, 'min_impurity_decrease': 0.0006041353956718231, 'ccp_alpha': 0.00012460140292955174}. Best is trial 200 with value: 0.4033658221541615.
[2026-07-12 19:35:23] [Ensayo] Trial 240 finished with value: 0.40138977586308117 and parameters: {'criterion': 'entropy', 'max_depth': 13, 'min_samples_split': 18, 'min_samples_leaf': 20, 'max_features': 0.5974437393928044, 'min_impurity_decrease': 5.9098502209796396e-06, 'ccp_alpha': 8.735647763861454e-05}. Best is trial 200 with value: 0.4033658221541615.
[2026-07-12 19:35:25] [Ensayo] Trial 241 finished with value: 0.40463247369344246 and parameters: {'criterion': 'entropy', 'max_depth': 13, 'min_samples_split': 18, 'min_samples_leaf': 20, 'max_features': 0.5965717379553447, 'min_impurity_decrease': 1.5694053656924175e-05, 'ccp_alpha': 8.505276336886387e-05}. Best is trial 241 with value: 0.40463247369344246.
[2026-07-12 19:35:27] [Ensayo] Trial 242 finished with value: 0.390833809421414 and parameters: {'criterion': 'entropy', 'max_depth': 13, 'min_samples_split': 18, 'min_samples_leaf': 20, 'max_features': 0.5999650781870964, 'min_impurity_decrease': 0.00017197794769088006, 'ccp_alpha': 7.78149799007086e-05}. Best is trial 241 with value: 0.40463247369344246.
[2026-07-12 19:35:28] [Ensayo] Trial 243 finished with value: 0.3829837603870692 and parameters: {'criterion': 'entropy', 'max_depth': 13, 'min_samples_split': 18, 'min_samples_leaf': 20, 'max_features': 0.5544700629753474, 'min_impurity_decrease': 0.00034588275401834835, 'ccp_alpha': 0.00020647287466147462}. Best is trial 241 with value: 0.40463247369344246.
