[2026-07-12 19:29:44] [Ensayo] A new study created in memory with name: dt_optimization
[2026-07-12 19:29:45] [Ensayo] Trial 0 finished with value: 0.2727721958046533 and parameters: {'criterion': 'entropy', 'max_depth': 10, 'min_samples_split': 2, 'min_samples_leaf': 10, 'max_features': 0.7210228991292947, 'min_impurity_decrease': 0.008221332595973593, 'ccp_alpha': 0.0033304077170151175}. Best is trial 0 with value: 0.2727721958046533.
[2026-07-12 19:29:45] [Ensayo] Trial 1 finished with value: 0.304693081642573 and parameters: {'criterion': 'entropy', 'max_depth': 7, 'min_samples_split': 12, 'min_samples_leaf': 13, 'max_features': 0.498145849215978, 'min_impurity_decrease': 0.006604047017652632, 'ccp_alpha': 2.940091896576791e-05}. Best is trial 1 with value: 0.304693081642573.
[2026-07-12 19:29:46] [Ensayo] Trial 2 finished with value: 0.2768794619100288 and parameters: {'criterion': 'entropy', 'max_depth': 15, 'min_samples_split': 19, 'min_samples_leaf': 17, 'max_features': 0.9730130896246926, 'min_impurity_decrease': 0.008327144783579224, 'ccp_alpha': 0.00311860643048804}. Best is trial 1 with value: 0.304693081642573.
[2026-07-12 19:29:47] [Ensayo] Trial 3 finished with value: 0.3008286894344333 and parameters: {'criterion': 'gini', 'max_depth': 4, 'min_samples_split': 5, 'min_samples_leaf': 20, 'max_features': 0.4175711180192375, 'min_impurity_decrease': 0.0037486770362340585, 'ccp_alpha': 0.004151897970677431}. Best is trial 1 with value: 0.304693081642573.
[2026-07-12 19:29:48] [Ensayo] Trial 4 finished with value: 0.3329164382779533 and parameters: {'criterion': 'gini', 'max_depth': 5, 'min_samples_split': 10, 'min_samples_leaf': 2, 'max_features': 0.607548942379309, 'min_impurity_decrease': 0.0006033566712171479, 'ccp_alpha': 0.0017562089169413293}. Best is trial 4 with value: 0.3329164382779533.
[2026-07-12 19:29:49] [Ensayo] Trial 5 finished with value: 0.34204899236616504 and parameters: {'criterion': 'entropy', 'max_depth': 11, 'min_samples_split': 19, 'min_samples_leaf': 19, 'max_features': 0.70661694841967, 'min_impurity_decrease': 0.001928040092186316, 'ccp_alpha': 0.0005204992476010423}. Best is trial 5 with value: 0.34204899236616504.
[2026-07-12 19:29:50] [Ensayo] Trial 6 finished with value: 0.357053866508398 and parameters: {'criterion': 'entropy', 'max_depth': 15, 'min_samples_split': 9, 'min_samples_leaf': 8, 'max_features': 0.5540001071065033, 'min_impurity_decrease': 0.000863187585824422, 'ccp_alpha': 0.00011108153429981282}. Best is trial 6 with value: 0.357053866508398.
[2026-07-12 19:29:51] [Ensayo] Trial 7 finished with value: 0.2727721958046533 and parameters: {'criterion': 'gini', 'max_depth': 4, 'min_samples_split': 12, 'min_samples_leaf': 5, 'max_features': 0.8166672978677046, 'min_impurity_decrease': 0.0060238902436592166, 'ccp_alpha': 0.003558462859578202}. Best is trial 6 with value: 0.357053866508398.
[2026-07-12 19:29:53] [Ensayo] Trial 8 finished with value: 0.3462338258321371 and parameters: {'criterion': 'entropy', 'max_depth': 13, 'min_samples_split': 20, 'min_samples_leaf': 14, 'max_features': 0.7893319665243175, 'min_impurity_decrease': 0.0019286288551555375, 'ccp_alpha': 0.0002013082210109496}. Best is trial 6 with value: 0.357053866508398.
[2026-07-12 19:29:53] [Ensayo] Trial 9 finished with value: 0.29214784475653827 and parameters: {'criterion': 'gini', 'max_depth': 6, 'min_samples_split': 19, 'min_samples_leaf': 14, 'max_features': 0.4463691761489407, 'min_impurity_decrease': 0.005587048688706163, 'ccp_alpha': 0.003595947743261899}. Best is trial 6 with value: 0.357053866508398.
[2026-07-12 19:29:54] [Ensayo] Trial 10 finished with value: 0.2768794619100288 and parameters: {'criterion': 'entropy', 'max_depth': 9, 'min_samples_split': 8, 'min_samples_leaf': 6, 'max_features': 0.9986488598913431, 'min_impurity_decrease': 0.009612869287345192, 'ccp_alpha': 0.004949968841939835}. Best is trial 6 with value: 0.357053866508398.
[2026-07-12 19:29:56] [Ensayo] Trial 11 finished with value: 0.3627137714106178 and parameters: {'criterion': 'entropy', 'max_depth': 15, 'min_samples_split': 15, 'min_samples_leaf': 9, 'max_features': 0.8263402898569354, 'min_impurity_decrease': 7.85342834794515e-05, 'ccp_alpha': 0.0011206069201098593}. Best is trial 11 with value: 0.3627137714106178.
[2026-07-12 19:29:57] [Ensayo] Trial 12 finished with value: 0.35001469876773933 and parameters: {'criterion': 'entropy', 'max_depth': 15, 'min_samples_split': 15, 'min_samples_leaf': 9, 'max_features': 0.5809474998584775, 'min_impurity_decrease': 0.00014571814480109568, 'ccp_alpha': 0.0013330508089084388}. Best is trial 11 with value: 0.3627137714106178.
[2026-07-12 19:29:59] [Ensayo] Trial 13 finished with value: 0.34404427554343714 and parameters: {'criterion': 'entropy', 'max_depth': 13, 'min_samples_split': 15, 'min_samples_leaf': 9, 'max_features': 0.8918451273889413, 'min_impurity_decrease': 0.002118769239113098, 'ccp_alpha': 0.0012732755286116323}. Best is trial 11 with value: 0.3627137714106178.
[2026-07-12 19:30:00] [Ensayo] Trial 14 finished with value: 0.3263575067023611 and parameters: {'criterion': 'entropy', 'max_depth': 13, 'min_samples_split': 7, 'min_samples_leaf': 6, 'max_features': 0.5735153279009381, 'min_impurity_decrease': 0.003607458843646549, 'ccp_alpha': 0.0023137817666809327}. Best is trial 11 with value: 0.3627137714106178.
[2026-07-12 19:30:01] [Ensayo] Trial 15 finished with value: 0.36536702735459403 and parameters: {'criterion': 'entropy', 'max_depth': 15, 'min_samples_split': 16, 'min_samples_leaf': 11, 'max_features': 0.6621854949832484, 'min_impurity_decrease': 8.673315325838154e-05, 'ccp_alpha': 0.0008889854878904212}. Best is trial 15 with value: 0.36536702735459403.
[2026-07-12 19:30:02] [Ensayo] Trial 16 finished with value: 0.32810326270165846 and parameters: {'criterion': 'entropy', 'max_depth': 12, 'min_samples_split': 16, 'min_samples_leaf': 12, 'max_features': 0.6849874701368204, 'min_impurity_decrease': 0.003349487902100534, 'ccp_alpha': 0.000914226714023938}. Best is trial 15 with value: 0.36536702735459403.
[2026-07-12 19:30:03] [Ensayo] Trial 17 finished with value: 0.34108282453844185 and parameters: {'criterion': 'entropy', 'max_depth': 15, 'min_samples_split': 17, 'min_samples_leaf': 3, 'max_features': 0.8349504067641271, 'min_impurity_decrease': 0.0012063814417377808, 'ccp_alpha': 0.002211199637898717}. Best is trial 15 with value: 0.36536702735459403.
[2026-07-12 19:30:05] [Ensayo] Trial 18 finished with value: 0.31844765648658563 and parameters: {'criterion': 'gini', 'max_depth': 14, 'min_samples_split': 13, 'min_samples_leaf': 11, 'max_features': 0.9022630587875788, 'min_impurity_decrease': 4.80558853132135e-05, 'ccp_alpha': 0.0020642370023749848}. Best is trial 15 with value: 0.36536702735459403.
[2026-07-12 19:30:06] [Ensayo] Trial 19 finished with value: 0.32703506840431257 and parameters: {'criterion': 'entropy', 'max_depth': 11, 'min_samples_split': 14, 'min_samples_leaf': 16, 'max_features': 0.6514099137313888, 'min_impurity_decrease': 0.002705300738594157, 'ccp_alpha': 0.0008589622845524018}. Best is trial 15 with value: 0.36536702735459403.
[2026-07-12 19:30:07] [Ensayo] Trial 20 finished with value: 0.32548722769706256 and parameters: {'criterion': 'entropy', 'max_depth': 8, 'min_samples_split': 17, 'min_samples_leaf': 7, 'max_features': 0.7588531911444814, 'min_impurity_decrease': 0.004903635988924296, 'ccp_alpha': 0.0027213506481765424}. Best is trial 15 with value: 0.36536702735459403.
[2026-07-12 19:30:08] [Ensayo] Trial 21 finished with value: 0.35519660107776385 and parameters: {'criterion': 'entropy', 'max_depth': 14, 'min_samples_split': 10, 'min_samples_leaf': 8, 'max_features': 0.5166925851138677, 'min_impurity_decrease': 0.0011397379774624574, 'ccp_alpha': 0.000628905585599101}. Best is trial 15 with value: 0.36536702735459403.
[2026-07-12 19:30:09] [Ensayo] Trial 22 finished with value: 0.3440340979792448 and parameters: {'criterion': 'entropy', 'max_depth': 14, 'min_samples_split': 10, 'min_samples_leaf': 11, 'max_features': 0.6360539970088335, 'min_impurity_decrease': 0.0013210745124488871, 'ccp_alpha': 0.0015162158274240063}. Best is trial 15 with value: 0.36536702735459403.
[2026-07-12 19:30:11] [Ensayo] Trial 23 finished with value: 0.38183029867920126 and parameters: {'criterion': 'entropy', 'max_depth': 15, 'min_samples_split': 2, 'min_samples_leaf': 4, 'max_features': 0.5216845702664844, 'min_impurity_decrease': 1.0688685127469965e-05, 'ccp_alpha': 0.00039954049998746364}. Best is trial 23 with value: 0.38183029867920126.
[2026-07-12 19:30:12] [Ensayo] Trial 24 finished with value: 0.36234674747918094 and parameters: {'criterion': 'entropy', 'max_depth': 12, 'min_samples_split': 3, 'min_samples_leaf': 4, 'max_features': 0.5173829867987036, 'min_impurity_decrease': 1.1035388902618813e-05, 'ccp_alpha': 0.0010587083520885569}. Best is trial 23 with value: 0.38183029867920126.
[2026-07-12 19:30:13] [Ensayo] Trial 25 finished with value: 0.3432078215075995 and parameters: {'criterion': 'entropy', 'max_depth': 14, 'min_samples_split': 5, 'min_samples_leaf': 1, 'max_features': 0.7492352330376248, 'min_impurity_decrease': 0.00236540855793746, 'ccp_alpha': 0.0005011637178897178}. Best is trial 23 with value: 0.38183029867920126.
[2026-07-12 19:30:14] [Ensayo] Trial 26 finished with value: 0.32325860521618854 and parameters: {'criterion': 'gini', 'max_depth': 12, 'min_samples_split': 6, 'min_samples_leaf': 4, 'max_features': 0.886652218901439, 'min_impurity_decrease': 0.000864931596346409, 'ccp_alpha': 0.0017883943753848296}. Best is trial 23 with value: 0.38183029867920126.
[2026-07-12 19:30:15] [Ensayo] Trial 27 finished with value: 0.3402601520498344 and parameters: {'criterion': 'entropy', 'max_depth': 15, 'min_samples_split': 17, 'min_samples_leaf': 15, 'max_features': 0.4594605858664265, 'min_impurity_decrease': 0.0014203609953381078, 'ccp_alpha': 0.0006219820268703448}. Best is trial 23 with value: 0.38183029867920126.
[2026-07-12 19:30:16] [Ensayo] Trial 28 finished with value: 0.3236241973528028 and parameters: {'criterion': 'entropy', 'max_depth': 13, 'min_samples_split': 12, 'min_samples_leaf': 12, 'max_features': 0.6582791828621832, 'min_impurity_decrease': 0.003111681176326033, 'ccp_alpha': 0.0010964592651923567}. Best is trial 23 with value: 0.38183029867920126.
[2026-07-12 19:30:18] [Ensayo] Trial 29 finished with value: 0.35480432892004243 and parameters: {'criterion': 'entropy', 'max_depth': 10, 'min_samples_split': 3, 'min_samples_leaf': 10, 'max_features': 0.6956950779940942, 'min_impurity_decrease': 0.0005195726887914191, 'ccp_alpha': 0.001520921922875335}. Best is trial 23 with value: 0.38183029867920126.
[2026-07-12 19:30:19] [Ensayo] Trial 30 finished with value: 0.31461808790669704 and parameters: {'criterion': 'entropy', 'max_depth': 14, 'min_samples_split': 2, 'min_samples_leaf': 7, 'max_features': 0.9437923332434378, 'min_impurity_decrease': 0.004305056487117317, 'ccp_alpha': 0.0003442796819269528}. Best is trial 23 with value: 0.38183029867920126.
[2026-07-12 19:30:21] [Ensayo] Trial 31 finished with value: 0.35560350149150527 and parameters: {'criterion': 'entropy', 'max_depth': 12, 'min_samples_split': 3, 'min_samples_leaf': 4, 'max_features': 0.5061734879356143, 'min_impurity_decrease': 5.638678728650091e-05, 'ccp_alpha': 0.0009518560083889499}. Best is trial 23 with value: 0.38183029867920126.
[2026-07-12 19:30:22] [Ensayo] Trial 32 finished with value: 0.3693621402763162 and parameters: {'criterion': 'entropy', 'max_depth': 11, 'min_samples_split': 2, 'min_samples_leaf': 1, 'max_features': 0.5436589572290482, 'min_impurity_decrease': 2.4141990577376857e-05, 'ccp_alpha': 0.0007481420159039388}. Best is trial 23 with value: 0.38183029867920126.
[2026-07-12 19:30:24] [Ensayo] Trial 33 finished with value: 0.3518754899838073 and parameters: {'criterion': 'entropy', 'max_depth': 9, 'min_samples_split': 2, 'min_samples_leaf': 3, 'max_features': 0.5517406692511897, 'min_impurity_decrease': 0.0016196590349892783, 'ccp_alpha': 0.000786669674788988}. Best is trial 23 with value: 0.38183029867920126.
[2026-07-12 19:30:25] [Ensayo] Trial 34 finished with value: 0.3658153081970851 and parameters: {'criterion': 'entropy', 'max_depth': 11, 'min_samples_split': 5, 'min_samples_leaf': 1, 'max_features': 0.4077663466826724, 'min_impurity_decrease': 0.00060661846672923, 'ccp_alpha': 7.723225594999004e-05}. Best is trial 23 with value: 0.38183029867920126.
[2026-07-12 19:30:26] [Ensayo] Trial 35 finished with value: 0.3699025688304241 and parameters: {'criterion': 'entropy', 'max_depth': 10, 'min_samples_split': 4, 'min_samples_leaf': 1, 'max_features': 0.4648825404580556, 'min_impurity_decrease': 0.0005314405180561856, 'ccp_alpha': 0.00020627313627624992}. Best is trial 23 with value: 0.38183029867920126.
[2026-07-12 19:30:26] [Ensayo] Trial 36 finished with value: 0.30492863630929545 and parameters: {'criterion': 'gini', 'max_depth': 10, 'min_samples_split': 5, 'min_samples_leaf': 1, 'max_features': 0.41841586940182557, 'min_impurity_decrease': 0.0025779703792249697, 'ccp_alpha': 9.282635576916002e-05}. Best is trial 23 with value: 0.38183029867920126.
[2026-07-12 19:30:27] [Ensayo] Trial 37 finished with value: 0.3582274418197439 and parameters: {'criterion': 'entropy', 'max_depth': 8, 'min_samples_split': 4, 'min_samples_leaf': 2, 'max_features': 0.47079857052694435, 'min_impurity_decrease': 0.0007207721989904137, 'ccp_alpha': 0.0002785170064817582}. Best is trial 23 with value: 0.38183029867920126.
[2026-07-12 19:30:28] [Ensayo] Trial 38 finished with value: 0.3472780230165388 and parameters: {'criterion': 'entropy', 'max_depth': 11, 'min_samples_split': 4, 'min_samples_leaf': 2, 'max_features': 0.4237074172654768, 'min_impurity_decrease': 0.0017503132862091671, 'ccp_alpha': 7.28695333153196e-06}. Best is trial 23 with value: 0.38183029867920126.
[2026-07-12 19:30:29] [Ensayo] Trial 39 finished with value: 0.2997330672250212 and parameters: {'criterion': 'gini', 'max_depth': 9, 'min_samples_split': 6, 'min_samples_leaf': 1, 'max_features': 0.48312591121757686, 'min_impurity_decrease': 0.007262613345081773, 'ccp_alpha': 0.00042253826202122153}. Best is trial 23 with value: 0.38183029867920126.
[2026-07-12 19:30:30] [Ensayo] Trial 40 finished with value: 0.3630746822402274 and parameters: {'criterion': 'entropy', 'max_depth': 8, 'min_samples_split': 4, 'min_samples_leaf': 3, 'max_features': 0.4015129352698459, 'min_impurity_decrease': 0.0006243936192094718, 'ccp_alpha': 0.0005794492035719824}. Best is trial 23 with value: 0.38183029867920126.
[2026-07-12 19:30:31] [Ensayo] Trial 41 finished with value: 0.36320260904028423 and parameters: {'criterion': 'entropy', 'max_depth': 10, 'min_samples_split': 2, 'min_samples_leaf': 1, 'max_features': 0.5405169728100621, 'min_impurity_decrease': 0.0005500703449717866, 'ccp_alpha': 0.0007674375487765138}. Best is trial 23 with value: 0.38183029867920126.
[2026-07-12 19:30:32] [Ensayo] Trial 42 finished with value: 0.3582361679854093 and parameters: {'criterion': 'entropy', 'max_depth': 11, 'min_samples_split': 6, 'min_samples_leaf': 19, 'max_features': 0.608824308110397, 'min_impurity_decrease': 0.0010455614563803293, 'ccp_alpha': 0.0003262668057734877}. Best is trial 23 with value: 0.38183029867920126.
[2026-07-12 19:30:33] [Ensayo] Trial 43 finished with value: 0.3716507846781224 and parameters: {'criterion': 'entropy', 'max_depth': 7, 'min_samples_split': 8, 'min_samples_leaf': 5, 'max_features': 0.4426587272475585, 'min_impurity_decrease': 0.0005234430323813542, 'ccp_alpha': 5.799049479111081e-05}. Best is trial 23 with value: 0.38183029867920126.
[2026-07-12 19:30:34] [Ensayo] Trial 44 finished with value: 0.29344710540132724 and parameters: {'criterion': 'entropy', 'max_depth': 3, 'min_samples_split': 7, 'min_samples_leaf': 5, 'max_features': 0.4482176763721589, 'min_impurity_decrease': 0.0016144078034214986, 'ccp_alpha': 1.6539436517500896e-05}. Best is trial 23 with value: 0.38183029867920126.
[2026-07-12 19:30:35] [Ensayo] Trial 45 finished with value: 0.3643528540486295 and parameters: {'criterion': 'entropy', 'max_depth': 6, 'min_samples_split': 9, 'min_samples_leaf': 2, 'max_features': 0.49031384233483616, 'min_impurity_decrease': 0.0006213949273204588, 'ccp_alpha': 0.0002703170842668762}. Best is trial 23 with value: 0.38183029867920126.
[2026-07-12 19:30:36] [Ensayo] Trial 46 finished with value: 0.3267375149860315 and parameters: {'criterion': 'entropy', 'max_depth': 7, 'min_samples_split': 3, 'min_samples_leaf': 5, 'max_features': 0.43651674635450954, 'min_impurity_decrease': 0.0021888311666934243, 'ccp_alpha': 0.0005235913290848008}. Best is trial 23 with value: 0.38183029867920126.
[2026-07-12 19:30:37] [Ensayo] Trial 47 finished with value: 0.34152887376513635 and parameters: {'criterion': 'gini', 'max_depth': 5, 'min_samples_split': 7, 'min_samples_leaf': 3, 'max_features': 0.5359553668091546, 'min_impurity_decrease': 0.0009921933926749092, 'ccp_alpha': 0.00020172885537447392}. Best is trial 23 with value: 0.38183029867920126.
[2026-07-12 19:30:38] [Ensayo] Trial 48 finished with value: 0.3161164364630927 and parameters: {'criterion': 'entropy', 'max_depth': 7, 'min_samples_split': 8, 'min_samples_leaf': 6, 'max_features': 0.5822552672872565, 'min_impurity_decrease': 0.00045911541480288075, 'ccp_alpha': 0.004729616110255508}. Best is trial 23 with value: 0.38183029867920126.
[2026-07-12 19:30:39] [Ensayo] Trial 49 finished with value: 0.3404797151953253 and parameters: {'criterion': 'entropy', 'max_depth': 6, 'min_samples_split': 4, 'min_samples_leaf': 2, 'max_features': 0.4041031552797864, 'min_impurity_decrease': 0.0018742187487040215, 'ccp_alpha': 0.0012978125475760767}. Best is trial 23 with value: 0.38183029867920126.
[2026-07-12 19:30:40] [Ensayo] Trial 50 finished with value: 0.3284404671349068 and parameters: {'criterion': 'entropy', 'max_depth': 9, 'min_samples_split': 5, 'min_samples_leaf': 4, 'max_features': 0.4798066634952458, 'min_impurity_decrease': 0.002875497435062256, 'ccp_alpha': 1.078275369359696e-05}. Best is trial 23 with value: 0.38183029867920126.
[2026-07-12 19:30:41] [Ensayo] Trial 51 finished with value: 0.35452052935655065 and parameters: {'criterion': 'entropy', 'max_depth': 11, 'min_samples_split': 2, 'min_samples_leaf': 1, 'max_features': 0.45445532845383235, 'min_impurity_decrease': 0.00036553147834647874, 'ccp_alpha': 0.0007519485871869338}. Best is trial 23 with value: 0.38183029867920126.
[2026-07-12 19:30:42] [Ensayo] Trial 52 finished with value: 0.36169016254074504 and parameters: {'criterion': 'entropy', 'max_depth': 13, 'min_samples_split': 20, 'min_samples_leaf': 2, 'max_features': 0.6139093283176844, 'min_impurity_decrease': 0.0009695007407137503, 'ccp_alpha': 0.00037112431748167145}. Best is trial 23 with value: 0.38183029867920126.
[2026-07-12 19:30:43] [Ensayo] Trial 53 finished with value: 0.3648893513649633 and parameters: {'criterion': 'entropy', 'max_depth': 10, 'min_samples_split': 11, 'min_samples_leaf': 3, 'max_features': 0.565459228496215, 'min_impurity_decrease': 0.0003231302959626458, 'ccp_alpha': 0.0006164755060588556}. Best is trial 23 with value: 0.38183029867920126.
[2026-07-12 19:30:44] [Ensayo] Trial 54 finished with value: 0.3518087621674727 and parameters: {'criterion': 'entropy', 'max_depth': 5, 'min_samples_split': 3, 'min_samples_leaf': 5, 'max_features': 0.5279181340352406, 'min_impurity_decrease': 0.0013232085162978126, 'ccp_alpha': 0.0009739212103667162}. Best is trial 23 with value: 0.38183029867920126.
[2026-07-12 19:30:46] [Ensayo] Trial 55 finished with value: 0.39509989134523993 and parameters: {'criterion': 'entropy', 'max_depth': 15, 'min_samples_split': 5, 'min_samples_leaf': 7, 'max_features': 0.500557859889184, 'min_impurity_decrease': 6.769589939034874e-05, 'ccp_alpha': 0.00014585808469419926}. Best is trial 55 with value: 0.39509989134523993.
[2026-07-12 19:30:47] [Ensayo] Trial 56 finished with value: 0.31237441134037763 and parameters: {'criterion': 'entropy', 'max_depth': 11, 'min_samples_split': 5, 'min_samples_leaf': 7, 'max_features': 0.43654942534775876, 'min_impurity_decrease': 0.00894326317052931, 'ccp_alpha': 0.00021377500573084893}. Best is trial 55 with value: 0.39509989134523993.
[2026-07-12 19:30:48] [Ensayo] Trial 57 finished with value: 0.3612766607393277 and parameters: {'criterion': 'entropy', 'max_depth': 12, 'min_samples_split': 6, 'min_samples_leaf': 6, 'max_features': 0.4945041933555722, 'min_impurity_decrease': 0.000826565779059219, 'ccp_alpha': 0.00044293710624042495}. Best is trial 55 with value: 0.39509989134523993.
[2026-07-12 19:30:50] [Ensayo] Trial 58 finished with value: 0.3835426734397581 and parameters: {'criterion': 'gini', 'max_depth': 13, 'min_samples_split': 8, 'min_samples_leaf': 4, 'max_features': 0.5035370976579587, 'min_impurity_decrease': 1.2636974541310291e-05, 'ccp_alpha': 0.00016761410282835058}. Best is trial 55 with value: 0.39509989134523993.
[2026-07-12 19:30:51] [Ensayo] Trial 59 finished with value: 0.35427265165441346 and parameters: {'criterion': 'gini', 'max_depth': 15, 'min_samples_split': 8, 'min_samples_leaf': 8, 'max_features': 0.5886270216300439, 'min_impurity_decrease': 9.233769999843395e-05, 'ccp_alpha': 0.0007075995240552321}. Best is trial 55 with value: 0.39509989134523993.
[2026-07-12 19:30:52] [Ensayo] Trial 60 finished with value: 0.32731380559690987 and parameters: {'criterion': 'gini', 'max_depth': 13, 'min_samples_split': 9, 'min_samples_leaf': 5, 'max_features': 0.510850633652825, 'min_impurity_decrease': 0.0013627666359517145, 'ccp_alpha': 0.0011640198607823283}. Best is trial 55 with value: 0.39509989134523993.
